date,reportlink,city,state,country,shape,duration,description,post_date,images
12/22/01 13:00,https://nuforc.org/webreports/reports/021/S21944.html,San Fernando (Chile),,Chile,Cigar,00:03,"TENIA FORMA DE CIGARRO Y DE COLOR BLANCO, AVANZABA LENTAMENTE, SE DETUVO EN UN MOMENTO INCLINANDOSE DE IZQUIERDA A DERECHA 3 VECES PARA",2/22/02,
12/17/01 19:18,https://nuforc.org/webreports/reports/042/S42129.html,St. Georges (Canada),MB,Canada,Cigar,1 min45 secs,"2 bright blue lights on a cigar shaped craft,",5/24/05,
12/11/01 14:03,https://nuforc.org/webreports/reports/020/S20769.html,Chesapeake,VA,USA,Cigar,6 Minutes,I saw 5 cigar shaped crafts in a V formation with lights.,1/11/02,
12/2/01 22:00,https://nuforc.org/webreports/reports/020/S20824.html,Orem,UT,USA,Cigar,5 minutes,"I saw a bright cigar shaped object changing colors in the sky, it was beautiful!",1/11/02,
12/1/01 20:45,https://nuforc.org/webreports/reports/020/S20627.html,S. Bossier,LA,USA,Cigar,40 seconds,"Two low altitude, large, slow moving craft, cigar shaped, odd light configuration and sounds.",12/5/01,
11/18/01 04:00,https://nuforc.org/webreports/reports/020/S20542.html,Baltimore,MD,USA,Cigar,1 minute,"Long, transparent object moving sideways across sky.",12/5/01,
11/16/01 13:30,https://nuforc.org/webreports/reports/020/S20433.html,North Hollywood,CA,USA,Cigar,10 - 15 seconds,Cigar shaped object with 3 bright round white lights,11/20/01,
11/11/01 23:20,https://nuforc.org/webreports/reports/020/S20144.html,Pleasantville,NY,USA,Cigar,4 or 5 secs,"cigar shaped object, very large and traveling very fast",11/20/01,
11/6/01 15:00,https://nuforc.org/webreports/reports/027/S27061.html,East Falmouth,MA,USA,Cigar,Day,I saw a cigar shaped UFO ovre a cranberry bog.,3/4/03,
11/4/01 22:07,https://nuforc.org/webreports/reports/020/S20071.html,Dublin,OH,USA,Cigar,10:25,"Two objects seen in sky; one oval with dim lights at front and rear, second traingular with pairs of dim lights at the tips.",11/20/01,
11/1/01 21:00,https://nuforc.org/webreports/reports/047/S47311.html,Gaithersburg,MD,USA,Cigar,three minutes,Blue Light/Cigar shaped craft/Euphoria?,11/3/05,
10/28/01 17:05,https://nuforc.org/webreports/reports/019/S19992.html,Little Rock,AR,USA,Cigar,1 minute,My wife an observed a cylindrical metal body craft that was flying a course from South to North or slightly Southwest to Northeast. The,9/28/02,
10/25/01 23:00,https://nuforc.org/webreports/reports/045/S45669.html,Hamilton (UK/Scotland),,United Kingdom,Cigar,2 mins.,"hovering lights,silent, making cloud",9/2/05,
10/13/01 17:30,https://nuforc.org/webreports/reports/020/S20392.html,"Franconia Notch (I-93, southbound)",NH,USA,Cigar,3 SECONDS,"UFO AT CANNON MOUNTAIN INT 93, N.H. OCT 13, 2001",1/11/02,
10/13/01 15:00,https://nuforc.org/webreports/reports/020/S20926.html,Franconia Notch/White Mountains,NH,USA,Cigar,2 seconds,"SIGHTING at FRANCONIA NOTCH, New Hampshire   October 13, 2001",1/11/02,
10/4/01 14:00,https://nuforc.org/webreports/reports/019/S19862.html,South Fork,CO,USA,Cigar,2 min,Shinny Cigar shape in sky on clear day.,11/20/01,
9/29/01 20:10,https://nuforc.org/webreports/reports/019/S19684.html,Houston (Spring/north suburbs),TX,USA,Cigar,3-5 seconds,Sliver of light crashes in North Houston,11/20/01,
9/28/01 02:30,https://nuforc.org/webreports/reports/019/S19714.html,Davison,MI,USA,Cigar,5 min,Davison Michigan's Cigars shaped space craft,10/12/01,
9/27/01 17:00,https://nuforc.org/webreports/reports/022/S22183.html,Kansas City,MO,USA,Cigar,45min,"I WAS DRIVING  MY CAR I SAW A BRIGHT SHINNING OBJECT TO MY LEFT AND THE AREA WAS WOODED,BUT AS I DROVE NEAR SOME CLEARING'S I SAW AN OB",3/19/02,
9/21/01 14:30,https://nuforc.org/webreports/reports/019/S19609.html,Omaha,NE,USA,Cigar,05 minutes,"Metallic hovering object seen near Offutt AFB, NE.",10/12/01,
9/16/01 13:14,https://nuforc.org/webreports/reports/019/S19563.html,Grand Rapids,MI,USA,Cigar,Approximately 1 minute,"It was a partly cloudy day.  I was returning from a drive to Ludington, Michigan.  I was at a traffic light waiting for it to change wh",10/12/01,
9/13/01 14:00,https://nuforc.org/webreports/reports/021/S21701.html,Kearney,MO,USA,Cigar,11sec,It was the day airplanes resumed flight after the sept.11 attacks. I was standing out in the pasture with my dogs enjoying the day. It,2/22/02,
9/11/01 12:30,https://nuforc.org/webreports/reports/027/S27665.html,Bradley Beach,NJ,USA,Cigar,2 minutes,"Cigar shaped object moving fast, southward from NYC.",3/21/03,
9/11/01 09:00,https://nuforc.org/webreports/reports/049/S49995.html,Erie,PA,USA,Cigar,Many Hours,Planes guided into the Trade Centers by UFOs.,5/15/06,
9/11/01 06:00,https://nuforc.org/webreports/reports/055/S55227.html,Hawley,MN,USA,Cigar,<1minute,cigar streaking across the sky eastward,2/24/07,
9/9/01 20:00,https://nuforc.org/webreports/reports/019/S19694.html,Angeles National Forest Area,CA,USA,Cigar,20-40 minutes,missile like ufo by southern california coastline.,10/12/01,
9/9/01 02:51,https://nuforc.org/webreports/reports/019/S19490.html,Wichita,KS,USA,Cigar,na.,looked like cigar on a still frame from the weather cam.,10/12/01,
9/8/01 17:30,https://nuforc.org/webreports/reports/019/S19470.html,Granite Falls,WA,USA,Cigar,1 minute,"Three adults were in the back yard of a home located about five miles east of Granite Falls,on the Mountain Loop Highway. It was about",10/12/01,
9/6/01 06:00,https://nuforc.org/webreports/reports/019/S19438.html,Frederick,MD,USA,Cigar,30 minutes,While commuting to Bethesda Md. from Hagerstown Md. I noticed a fluorescent cloud in the eastern sky. This cloud glowed with light simi,10/12/01,
9/6/01 05:50,https://nuforc.org/webreports/reports/019/S19437.html,Waterford,CT,USA,Cigar,1min. 25 sec.,Missile-shaped object flies over Nuclear Facility in Waterford CT.,10/12/01,
9/6/01 05:50,https://nuforc.org/webreports/reports/019/S19441.html,Leesburg,VA,USA,Cigar,5 minutes,Large aircraft was ascending and emitted bright white trail of smoke that stayed luminated for 45 minutes.,10/12/01,
9/1/01 19:00,https://nuforc.org/webreports/reports/068/S68798.html,Gig Harbor,WA,USA,Cigar,2 min,blue silicon craft - cigar shape - est. size length of football field - white light radiating from mid point in length of craft,3/19/09,
8/29/01 22:30,https://nuforc.org/webreports/reports/019/S19344.html,East Killingly,CT,USA,Cigar,5 minutes,Streaming lights moving above trees.,10/12/01,
8/28/01 13:00,https://nuforc.org/webreports/reports/019/S19369.html,Nashville,IL,USA,Cigar,5 minutes,Cigar shaped UFO sighted while fishing.,10/12/01,
8/25/01 19:45,https://nuforc.org/webreports/reports/019/S19260.html,Kanata (Canada),ON,Canada,Cigar,~ 8 minutes,"Cylindrical shape, quasi-transparent dome like structure attached on top flying high. Kanata Ontario, Canada.",10/12/01,
8/17/01 08:10,https://nuforc.org/webreports/reports/019/S19033.html,Fulton,MO,USA,Cigar,2 minutes,Silver cigar over Central Missouri,8/20/01,
8/16/01 00:00,https://nuforc.org/webreports/reports/047/S47047.html,Charlotte,NC,USA,Cigar,,"it was dark outside but i could see that they were shiny like silver and they were big,they hovered over a field for about 10 mins then",10/20/05,
8/11/01 08:20,https://nuforc.org/webreports/reports/019/S19838.html,London (UK/England),,United Kingdom,Cigar,Unknown,"I felt compelled to look up into the sky, even though i had heard nothing",11/20/01,
8/10/01 11:47,https://nuforc.org/webreports/reports/018/S18911.html,"Philadelphia (suburbs of, Hwy/Rt. 476)",PA,USA,Cigar,20 seconds,TRUCK SIZE CIGAR SHAPE OBJECT OVER THE BLUE ROUT 476 in the SUBERBS OF PHILADELPHIA,8/12/01,
8/9/01 22:00,https://nuforc.org/webreports/reports/019/S19225.html,Calico Rock,AR,USA,Cigar,,"Cigar shaped, aproxematly 100 ft. long, lights on each end that changed color, and made 3 musical tones.",10/12/01,
8/5/01 21:20,https://nuforc.org/webreports/reports/018/S18868.html,Chino,CA,USA,Cigar,1 minute,One Green blinking object; two red objects fly in southwest sky before vanishing.,8/12/01,
8/4/01 21:00,https://nuforc.org/webreports/reports/018/S18834.html,Ashtabula,OH,USA,Cigar,2 min.,"two silver cigar shaped objects. Objects apprear to have bright silver lighting running down the middle. Moving slowly,one moving east,",8/5/01,
8/3/01 12:14,https://nuforc.org/webreports/reports/018/S18819.html,Tempe,AZ,USA,Cigar,2 minutes,"The movement away from me was too quick to be a blimp, and the change in direction to sudden for a plane.",8/5/01,
8/2/01 07:25,https://nuforc.org/webreports/reports/018/S18946.html,Alton,VA,USA,Cigar,10 seconds,On my way to work on Thursday  8-2-01 I stopped at a local gas station.  As I left I looked to my left before pulling out and saw a lar,8/20/01,
8/1/01 16:30,https://nuforc.org/webreports/reports/026/S26359.html,Sandstone,MN,USA,Cigar,2min. or so,I saw a light in the sky that disappeared in front of my eye.,12/23/02,
8/1/01 07:00,https://nuforc.org/webreports/reports/018/S18856.html,Hagerstown,MD,USA,Cigar,2 minutes,"CIGAR SHAPED, MOVING SLOWLY ABOVE TREE LINE , BRIGHT OBJECT EMITTED FROM END, SHOT INTO SKY.",8/12/01,
7/31/01 23:30,https://nuforc.org/webreports/reports/018/S18859.html,Tony,WI,USA,Cigar,8-10 sec.,very large craft  seen near Ladysmith Wisconsin,8/12/01,
7/31/01 06:40,https://nuforc.org/webreports/reports/018/S18839.html,Hagerstown,MD,USA,Cigar,30 seconds,"White cigar-shaped light, travelling fast NNE to SSE, emited second small light which arced downwards.",8/12/01,
7/23/01 19:45,https://nuforc.org/webreports/reports/018/S18595.html,Langlois,OR,USA,Cigar,60 seconds,"A long rocket like cigar with ""fins"" attached to it's body flying in a seemingly upward pitch.",8/5/01,
7/23/01 00:09,https://nuforc.org/webreports/reports/053/S53478.html,Spring Valley,NV,USA,Cigar,5 min.,Cigar shaped craft over vegas.,12/7/06,
7/19/01 11:45,https://nuforc.org/webreports/reports/029/S29858.html,North Las Vegas,NV,USA,Cigar,6-7 seconds,cigar shaped object flys u mountain range,7/23/03,
7/18/01 22:30,https://nuforc.org/webreports/reports/018/S18490.html,Oklahoma City,OK,USA,Cigar,30 seconds,"Object seen pacing small aircraft over Oklahoma City,OK",8/5/01,
7/14/01 12:00,https://nuforc.org/webreports/reports/041/S41182.html,Odessa,TX,USA,Cigar,,White 767 whith a thin cigar shape object trailing in the sky.,1/19/05,
7/13/01 17:30,https://nuforc.org/webreports/reports/018/S18918.html,Irrigon,OR,USA,Cigar,45 seconds,Very Large cigar/cone shaped object witnessed over Columbia River.,8/12/01,
7/3/01 20:15,https://nuforc.org/webreports/reports/021/S21525.html,Collegeville,PA,USA,Cigar,5 minutes,"I was coming out of the Collegeville ACME, the moon was rising and the sun was setting and I looked up. There was, what looked like, a",1/29/02,
7/1/01 13:00,https://nuforc.org/webreports/reports/039/S39084.html,Longmont,CO,USA,Cigar,Around 30 seconds,Cigar shaped craft with 5 or 6 red and white lights,9/9/04,
6/27/01 15:45,https://nuforc.org/webreports/reports/018/S18222.html,Los Angeles,CA,USA,Cigar,45 min,cigar like object changing orientation for about 40 min over LA on clear day,8/5/01,
6/21/01 04:55,https://nuforc.org/webreports/reports/018/S18121.html,Shreveport,LA,USA,Cigar,10 minutes,"Cigar shaped intense white light surrounded by blue, then yellow in the distance",8/5/01,
6/18/01 16:50,https://nuforc.org/webreports/reports/018/S18083.html,New York City,NY,USA,Cigar,15 Mins,Star-like object in blue New York City sky.,8/5/01,
6/17/01 19:40,https://nuforc.org/webreports/reports/018/S18141.html,Pottstown,PA,USA,Cigar,10 minutes,"white, cigar shaped unidentified flying object over Pottstown, Pa.",8/5/01,
6/15/01 16:00,https://nuforc.org/webreports/reports/028/S28819.html,Spring Mills,WV,USA,Cigar,30 sec,Cigar shaped craft over I-81 at truck stop .,5/27/03,
6/9/01 07:30,https://nuforc.org/webreports/reports/018/S18293.html,Los Angeles,CA,USA,Cigar,20 min,"I was walking to the restroom from the parking lot of Carl's Junior when I noticed an object far away.  Not caring, because of so many",8/5/01,
6/6/01 21:45,https://nuforc.org/webreports/reports/017/S17922.html,Alvin,TX,USA,Cigar,<1 minute,"Flying Submarine whistles over treetops frightening three teenage witnesses in Alvin, Texas then shoots off and vanishes",8/5/01,
6/6/01 12:30,https://nuforc.org/webreports/reports/018/S18025.html,Cusick,WA,USA,Cigar,45 to 50 minutes,I was walking in a field when at my three o'clock I saw a UFO.,8/5/01,
5/19/01 14:17,https://nuforc.org/webreports/reports/017/S17694.html,Palatine,IL,USA,Cigar,2 minutes,"Metallic,  missile shaped object flying extremely high above the clouds.",8/5/01,
5/16/01 00:45,https://nuforc.org/webreports/reports/017/S17667.html,Columbia,IL,USA,Cigar,45 minutes,"A rectangular, yellow band of light from an object that made very quick, precise movements in any direction.",8/5/01,
5/14/01 05:30,https://nuforc.org/webreports/reports/017/S17659.html,"Wollongong (NSW, Australia)",,Australia,Cigar,15 min.,Bright Cigar object. Very high altitute on east.Traveling from north to south. Strong light was flashing from time to time. Time betwee,8/5/01,
5/13/01 18:45,https://nuforc.org/webreports/reports/017/S17647.html,Ferme-Neuve (Canada),PQ,Canada,Cigar,3 -4 minutes,Luminous stationnary cigar shaped objet seen in QuÃ©bec sky,8/5/01,
4/20/01 01:30,https://nuforc.org/webreports/reports/017/S17466.html,Reidsville,NC,USA,Cigar,20 minutes,Reidsville Prom Sighting,8/5/01,
4/13/01 22:30,https://nuforc.org/webreports/reports/017/S17250.html,Kensington,CT,USA,Cigar,about 15 min,Possible UFO sighting over Kensington Conn on 4/13/01.,4/28/01,
4/7/01 22:15,https://nuforc.org/webreports/reports/017/S17195.html,Milwaukee,WI,USA,Cigar,30-45 seconds,"Object entered atmosphere as a streak, emitted a momentary high frequency, zig-zaging effortlessly from east to west",4/28/01,
4/7/01 15:30,https://nuforc.org/webreports/reports/017/S17587.html,Pepper Pike,OH,USA,Cigar,10 seconds,"Large, silver cigar, hovering low on horizion, half the size of my finger at arms length, in northeast.",8/5/01,
3/31/01 07:40,https://nuforc.org/webreports/reports/017/S17087.html,Dublin,CA,USA,Cigar,2-4 min.,"White, cigar-shaped object flying over Dublin, CA 7:40 am most mornings.",4/1/01,
3/30/01 09:10,https://nuforc.org/webreports/reports/017/S17047.html,Solihull (UK/England),,United Kingdom,Cigar,25mins,Cigar shaped object with flashing lights and a buzzing sound,4/1/01,
3/26/01 21:00,https://nuforc.org/webreports/reports/016/S16983.html,Valentine,NE,USA,Cigar,5 minutes,"extremely large cigar shaped craft, i'd say at least 200 yards long, 2 flashiing lights on each end.",4/1/01,
3/25/01 11:00,https://nuforc.org/webreports/reports/017/S17341.html,Burnaby (Canada),BC,Canada,Cigar,20 seconds,A picture of a UFO flying over a high school.,4/28/01,
3/23/01 23:30,https://nuforc.org/webreports/reports/017/S17320.html,Roma (Italy),,Italy,Cigar,1h,percorrendo via della nocetta ce sta tipo n'incrocio anzi e' n'incrocio li ce sta l'amichetto blu e verde,4/28/01,
3/20/01 10:15,https://nuforc.org/webreports/reports/016/S16997.html,Austin,TX,USA,Cigar,3-5 minutes,"Driving soutth on Mo Pac Expressway, I saw two black cigar shaped objects hovering.",4/1/01,
3/17/01 02:46,https://nuforc.org/webreports/reports/017/S17049.html,Orchard Park,NY,USA,Cigar,approx 7minutes,Very intense light flying together in a group of three with short sparadic motions.,4/1/01,
3/15/01 10:00,https://nuforc.org/webreports/reports/016/S16889.html,Benson,AZ,USA,Cigar,15 secs.,White cigar-shaped object flew straight into mountains and between peaks without stopping,4/1/01,
3/13/01 23:50,https://nuforc.org/webreports/reports/016/S16857.html,Seattle,WA,USA,Cigar,10 seconds,"23:50 on 3/13/01, an object with orange lights flew at remarkable speed, silently, from south to north over Puget Sound.",3/16/01,
3/12/01 07:45,https://nuforc.org/webreports/reports/016/S16818.html,Dublin,CA,USA,Cigar,3 min.,"White, cigar-shaped, silent object flying at low altitude.",3/16/01,
3/8/01 20:30,https://nuforc.org/webreports/reports/016/S16769.html,Massillon,OH,USA,Cigar,3 minutes,"Was a small looking cigar/bone shaped white thing with a little red on it in the sky heading N.W at 6:30 EST on Friday March  8, 2001.",3/16/01,
3/5/01 15:30,https://nuforc.org/webreports/reports/016/S16733.html,Roscoe and Ft. Justice (between),TX,USA,Cigar,45 minutes,"I noticed a very strange airplane flying low to the ground.  It would circle and then hover, circle and then hover.",3/16/01,
2/22/01 19:20,https://nuforc.org/webreports/reports/016/S16597.html,Millsap,TX,USA,Cigar,2 minutes,"We saw one craft. It travelled left to right with very bright lights that were luminous of yellowish green. The lights disappeared, all",2/24/01,
2/18/01 17:00,https://nuforc.org/webreports/reports/016/S16550.html,Cabazon,CA,USA,Cigar,5 min,"Cigar shaped object, heading west from east, that glowed in the sky like a floresent light bulb.",2/24/01,
2/8/01 19:44,https://nuforc.org/webreports/reports/016/S16377.html,Wakefield (UK/England),,United Kingdom,Cigar,30SECONDS,"IT WAS BRIGHT GREEN, WITH A ORANGE/YELLOW TAIL, MOVING FROM EAST TO WEST, DID NOT HEAR ANY SOUNDS FROM IT, ALL HAPPEND IN A FEW SECONDS",2/18/01,
1/28/01 18:30,https://nuforc.org/webreports/reports/016/S16101.html,Orlando,FL,USA,Cigar,6:30:45,Look at the superbowl replay if you saw it or not ask the take they will show the score board and juste at the left of it a fearly fast,2/18/01,
1/12/01 21:05,https://nuforc.org/webreports/reports/015/S15914.html,Lancaster,OH,USA,Cigar,10 minutes,We watched a cigar/cylinder shaped object about ten degrees above the horizon.,2/18/01,
1/10/01 18:20,https://nuforc.org/webreports/reports/015/S15872.html,Eagle Rock,CA,USA,Cigar,2-4 minutes,1/10/01 6:20 PM. Saw a large elongated tube cigar like object. Dark outside. Several long stream blinking lights. I was bewildered,2/18/01,
1/10/01 16:30,https://nuforc.org/webreports/reports/015/S15874.html,Waldoboro,ME,USA,Cigar,10-15-min,"red cigar shaped object in sky over Waldoboro, Maine",2/18/01,
1/10/01 05:13,https://nuforc.org/webreports/reports/031/S31667.html,Arden,NC,USA,Cigar,30 secs,High SPeed Cigar Shaped Object - Sky Turning  Brighter Than Noon for 1000 Miles For Over 20 Secs,9/24/03,
1/9/01 17:30,https://nuforc.org/webreports/reports/015/S15868.html,Spokane,WA,USA,Cigar,,i was rideing my bike home from shcool and saw a cigar saped object in the sky it had two lights on each of the sides and one bright li,2/18/01,
1/8/01 07:00,https://nuforc.org/webreports/reports/015/S15828.html,Santa Fe,NM,USA,Cigar,15 minutes,large  cigar shaped craft,2/18/01,
1/5/01 18:40,https://nuforc.org/webreports/reports/015/S15787.html,Baytown,TX,USA,Cigar,15 MIN,LARGE OBLONG CIGAR SHAPED WINGLESS BRIGHT OBJECT MOVING EAST TO WEST OVER HOUSTON TEXAS,2/18/01,
1/4/01 16:00,https://nuforc.org/webreports/reports/016/S16043.html,Anderson,SC,USA,Cigar,12-20 min,"White large object without wings,above 30,000 feet moving very slowy toward the NNW",2/18/01,
1/1/01 17:00,https://nuforc.org/webreports/reports/020/S20765.html,Copenhagen (Denmark),,Denmark,Cigar,1-2minutes,"I was visiting my mother in Copenhagen together with two of my children and my brother. We we in the livingroom, the window here is ver",1/11/02,
12/25/00 12:20,https://nuforc.org/webreports/reports/015/S15663.html,Tucson,AZ,USA,Cigar,3-4 seconds,Shiny silver object that reflected the sun emerged in the south sky moving east to west then abruptly disappeared.,1/3/01,
12/23/00 16:30,https://nuforc.org/webreports/reports/033/S33975.html,Zumbrota,MN,USA,Cigar,30 sec.,"Silver cigar shaped object travelling low, and at great speed on US 52 in SE Minnesota.",1/17/04,
12/6/00 18:40,https://nuforc.org/webreports/reports/016/S16892.html,Forks,WA,USA,Cigar,seven min.,Two paralell light were jolting back and forth around the moon.,4/1/01,
12/3/00 23:30,https://nuforc.org/webreports/reports/015/S15392.html,New Forest (UK/England),,United Kingdom,Cigar,1 min,it was flying low hovering at first the moving off slowly before it dissaperd,12/9/00,
11/23/00 18:37,https://nuforc.org/webreports/reports/015/S15021.html,El Paso and Alamogordo (Between ),NM,USA,Cigar,3 minutes,A dark cigar-shaped object with no lights that was at least 100 meters wide.,12/2/00,
11/22/00 08:30,https://nuforc.org/webreports/reports/015/S15123.html,Delta (Canada),BC,Canada,Cigar,about 2 minutes,"Silvery cigar hovers, dissappears, reaapears and dissappears over Boundary Bay",12/2/00,
10/30/00 16:00,https://nuforc.org/webreports/reports/014/S14759.html,McMinnville,OR,USA,Cigar,5 minutes,Long white cigar shaped object seen over McMinnville Oregon heading south,12/2/00,
10/28/00,https://nuforc.org/webreports/reports/022/S22943.html,Springfield,MO,USA,Cigar,9 min.,"grey, dull, metallic looking Cigar craft",6/12/02,
10/23/00 17:30,https://nuforc.org/webreports/reports/014/S14680.html,Kamiah,ID,USA,Cigar,10 min each,(This report will include 3 seperate sightings on the same night from different locations. All witnesses are members of the same family,12/2/00,
10/19/00 06:30,https://nuforc.org/webreports/reports/014/S14605.html,Old Fort,TN,USA,Cigar,20-30 sec,A yellow color cigar shaped objet moving very fast from NW to SW.,12/2/00,
10/15/00 21:10,https://nuforc.org/webreports/reports/015/S15636.html,Middletown,CA,USA,Cigar,1 minute,"I am an engineer and was startled since I have never seen anything like this before. While driving home from shopping, I saw an bright",1/3/01,
10/15/00 16:30,https://nuforc.org/webreports/reports/017/S17360.html,Phoenix,AZ,USA,Cigar,OVER CRISSTOWN MALL,CIGAR OVER CRISS TOWN MALL IN PHX.,4/28/01,
10/14/00 14:18,https://nuforc.org/webreports/reports/014/S14553.html,Breezewood,PA,USA,Cigar,2 minutes,Chemtrails produce UFO,12/2/00,
10/12/00 18:00,https://nuforc.org/webreports/reports/014/S14577.html,Belmont,VT,USA,Cigar,10 minutes,"The cigar shaped craft was hovering in the southwestern sky fairly close to the ground.  There were lights on it.  There was a bright """,12/2/00,
10/1/00 19:40,https://nuforc.org/webreports/reports/014/S14457.html,Chandler,AZ,USA,Cigar,20 SEC,tHIS IS A CORRECTION TO A REPORT THAT I MADE LAST WEEK.   WHEN WE SAW THE LIGHT MY WIFE AND NEIGHBOR WERE BEHIND ME AND THEY WSAW THE O,12/2/00,
10/1/00 09:00,https://nuforc.org/webreports/reports/071/S71115.html,Markham (Canada),ON,Canada,Cigar,10 min,"It was some time in oct 2000.I was taking my wife to work on Markham road, traveling south bound. There was a lot of traffic and lots o",8/5/09,
9/26/00 13:00,https://nuforc.org/webreports/reports/014/S14268.html,Jordan,MN,USA,Cigar,2 minutes,It was cigar shaped with a fin shaped tail it was very quiet it was silver and then changed to blue,12/2/00,
9/20/00 15:30,https://nuforc.org/webreports/reports/014/S14584.html,Kota Kinabalu/Sabah (Malaysia),,Malaysia,Cigar,8 minutes,glowing white cigar shaped cylindrical object,12/2/00,
9/17/00 16:00,https://nuforc.org/webreports/reports/014/S14233.html,Cleveland,OH,USA,Cigar,5 min,long silver cigar shaped flying high with no vapor trail and no sound,12/2/00,
9/16/00 17:54,https://nuforc.org/webreports/reports/014/S14161.html,Fort Wayne,IN,USA,Cigar,15 secs,Dark gray colored object with two big circles on the side,9/21/00,
9/13/00 20:10,https://nuforc.org/webreports/reports/014/S14109.html,Sikeston,MO,USA,Cigar,2 minutes,Cigar shaped Object in Sikeston,9/17/00,
9/12/00 23:30,https://nuforc.org/webreports/reports/014/S14097.html,Windsor (Canada),ON,Canada,Cigar,2 minutes,"September 12, 2000 - 11:30 pm - Windsor, Ontario, Canada - glowing cigar-shaped craft spotted over Casino Windsor/Detroit River",12/2/00,
9/11/00 22:10,https://nuforc.org/webreports/reports/014/S14157.html,Lares (Puerto Rico),PR,Puerto Rico,Cigar,5-8 Sec.,"I spotted a cigar shaped object in mid-air while outside one night in Lares, PR.",9/21/00,
9/10/00 19:00,https://nuforc.org/webreports/reports/023/S23647.html,Bradford/Baildon Moor (UK/England),,United Kingdom,Cigar,1min,UFO OVER MOORS?,7/26/02,
9/8/00 15:30,https://nuforc.org/webreports/reports/014/S14597.html,Walla Walla,WA,USA,Cigar,ten minutes,"the object was intentionatly staying at a standstill.  Every jet flying moves accross the sky, we felt that this was on purpose",12/2/00,
9/3/00 22:45,https://nuforc.org/webreports/reports/014/S14185.html,Rosthern (Canada),SA,Canada,Cigar,few seconds,I defintely saw a silvery cigar shaped object descending,12/2/00,
9/2/00 04:00,https://nuforc.org/webreports/reports/013/S13970.html,Seattle,WA,USA,Cigar,2-3 seconds,Cigar shaped object with several blueish white lights on side sighted moving easterly over Queen Anne neighborhood,9/17/00,
8/18/00 20:00,https://nuforc.org/webreports/reports/028/S28337.html,Prairie   Grove,AR,USA,Cigar,30 Seconds,"Strange white cigar shaped light in the sky, observed for 30 seconds.",4/22/03,
8/15/00 21:44,https://nuforc.org/webreports/reports/013/S13792.html,Dallas,TX,USA,Cigar,1-1.5 seconds,"Pie shaped craft ignited rocketlike engine ,skipped across the sky and vanished silently at tremendous speed.",8/19/00,
8/12/00 01:30,https://nuforc.org/webreports/reports/013/S13761.html,Stockport (UK/England),,United Kingdom,Cigar,7 seconds,observed 2 dull brown cigar shaped objects travelling very fast from east to west in a staggered parallel formation,8/19/00,
8/11/00 18:45,https://nuforc.org/webreports/reports/015/S15364.html,Lakeland,FL,USA,Cigar,,"it was dark out side as i stepped off the porch to go feed my dog, i heard that he was barking at somthing towards the woods so i walke",12/9/00,
8/4/00 22:00,https://nuforc.org/webreports/reports/033/S33655.html,Tupper Lake,NY,USA,Cigar,30 mins,6 lights in a straite line stood directley over a barn for about 30 mins b4 completly disapearing,12/9/03,
8/3/00 07:40,https://nuforc.org/webreports/reports/015/S15124.html,Delta (Canada),BC,Canada,Cigar,about 5 minutes,Silvery cigar hovers over Boundary Bay,12/2/00,
