date,reportlink,city,state,country,shape,duration,description,post_date,images
7/13/09 13:00,https://nuforc.org/webreports/reports/071/S71064.html,Phoenix,AZ,USA,Cigar,50 seconds,Daylight sighting of a long cigar shaped object that  slowly disappears,8/5/09,
7/13/09 03:00,https://nuforc.org/webreports/reports/071/S71058.html,Derbyshire (UK/England),,United Kingdom,Cigar,10 mins,Strange row of lights in the sky,8/5/09,
7/12/09 23:43,https://nuforc.org/webreports/reports/071/S71055.html,Barrie (Canada),ON,Canada,Cigar,2 minutes,my brother in law and I were outside on the back deck talking and I saw what I thought was a falling star. It was a light orange colour,8/5/09,
7/8/09 13:56,https://nuforc.org/webreports/reports/071/S71054.html,Hudson Falls,NY,USA,Cigar,unknown,((HOAX??))  we went into the woods where we had built a cabin.,8/5/09,
7/7/09 15:28,https://nuforc.org/webreports/reports/074/S74603.html,Satsuma,AL,USA,Cigar,<1 minute,"Long cigar-shaped object that is 2/3's dark & 1/3 bright, seen in eastern sky traveling WNW.",4/13/10,
7/7/09 13:00,https://nuforc.org/webreports/reports/085/S85290.html,Lincoln,ME,USA,Cigar,5 seconds,"Clear day,large cigar shaped object",12/12/11,
7/5/09 17:40,https://nuforc.org/webreports/reports/070/S70900.html,Hallsville,TX,USA,Cigar,20-25 seconds,Hallsville TX pipe or tube shaped UFO as a storm moved in from the west.,8/5/09,
7/4/09 22:02,https://nuforc.org/webreports/reports/070/S70879.html,Philadelphia,PA,USA,Cigar,18 minutes,The object is clearly visible  moving across many pictures taken from a stationary camera on a tripod.,8/5/09,
7/4/09 20:30,https://nuforc.org/webreports/reports/070/S70851.html,Boxford,MA,USA,Cigar,5 min,Cigar shaped siting,8/5/09,
7/4/09 12:15,https://nuforc.org/webreports/reports/070/S70841.html,St. Thomas (Canada),ON,Canada,Cigar,5 mins,Cigar shape craft spotted moving iradically above st.thomas Ontario,8/5/09,
7/4/09 02:56,https://nuforc.org/webreports/reports/070/S70847.html,Philadelphia,PA,USA,Cigar,2 minuets,dark gray object over the city of Philadelphia for 2 minuets,8/5/09,
7/2/09 17:40,https://nuforc.org/webreports/reports/070/S70971.html,"Gaios, Paxos (Hellenic Republic)",,Hellenic Republic,Cigar,40 seconds,"One mile NW of Gaios,Paxos,Corfu,Greece.

 Large white cigar shaped object at high altitude. Possibly three times the length of a reg",8/5/09,
7/1/09 00:00,https://nuforc.org/webreports/reports/120/S120758.html,Wichita,KS,USA,Cigar,30 seconds,Long silver and blue black craft.,7/31/15,
6/29/09 14:50,https://nuforc.org/webreports/reports/070/S70758.html,Smyrna,GA,USA,Cigar,1 minute,"Very shiny cigar shaped object north of Smyrna, GA around 2:50 pm.",8/5/09,
6/27/09 16:00,https://nuforc.org/webreports/reports/137/S137436.html,Fort Davis,TX,USA,Cigar,10 minutes,"My Boy Scout Troop saw cigar-shaped object in thunderstorm over desert near Marfa, Texas.",12/4/17,
6/24/09 22:30,https://nuforc.org/webreports/reports/070/S70695.html,Morrisville,NY,USA,Cigar,20 seconds,Large bright light in the sky and when it turned it appeared to be cigar shaped with a red light on its front.,8/5/09,
6/22/09 21:15,https://nuforc.org/webreports/reports/070/S70925.html,Egan,SD,USA,Cigar,2 to 3 minutes,"White cigar shaped object in sight for 2 to 3 minutes sighting duration. No noise, contralis, etc.",8/5/09,
6/19/09 15:00,https://nuforc.org/webreports/reports/070/S70565.html,Sand Springs,OK,USA,Cigar,2 MINUTES,A cigar shaped object with 5 lights running left to right.The outer light were pulsing.Sounds similar to another sighting over Shell la,8/5/09,
6/19/09 08:44,https://nuforc.org/webreports/reports/070/S70788.html,New York City (Brooklyn),NY,USA,Cigar,30 minutes,the lights were streaming straight across and i was fascinated,8/5/09,
6/15/09 22:00,https://nuforc.org/webreports/reports/070/S70530.html,Emeryville,CA,USA,Cigar,3-4 seconds,Fast moving linear object with three lights in a night sky.,8/5/09,
6/4/09 10:12,https://nuforc.org/webreports/reports/070/S70376.html,San Antonio,TX,USA,Cigar,1 minnute,Cigar shaped object over the San Antonio International Airport Thursday June 4th 2009 10:12 am CDT,6/9/09,
5/20/09 01:34,https://nuforc.org/webreports/reports/070/S70128.html,Highgate,VT,USA,Cigar,approximatley 11.213 seco,"we saw many, many, MANY lights. flying overhead. A strange beam of light came above us, and a a funny feeling came over all three of us",6/9/09,
5/17/09 11:00,https://nuforc.org/webreports/reports/070/S70144.html,Jasper,AL,USA,Cigar,10 minutes approx.,"Cigar shaped, iridescent craft. Soundless...seen over Jasper,AL",6/9/09,
5/14/09 22:02,https://nuforc.org/webreports/reports/070/S70042.html,Tulsa,OK,USA,Cigar,10 seconds max,"Large very bright bluish white ""strip"" of light seen on bottom of a large craft",6/9/09,
5/3/09 00:00,https://nuforc.org/webreports/reports/069/S69928.html,Rockford,MI,USA,Cigar,30 Seconds,"Dated May 3, 2009, approx. 11:00 AM, while drift fishing on a clear breezy day, on the South/West side of Little Myers Lake, I looked u",5/12/09,
4/30/09 21:33,https://nuforc.org/webreports/reports/069/S69896.html,College Place,WA,USA,Cigar,1 second,"04/30/09  College Place WA.  brown cigar shaped object moving N to S at high rate of speed,no sound, low to ground",5/12/09,
4/30/09 15:00,https://nuforc.org/webreports/reports/069/S69890.html,Highland,IN,USA,Cigar,3-4 mins,Slow moving dark object flying in the sky.,5/12/09,
4/26/09 22:15,https://nuforc.org/webreports/reports/069/S69833.html,Bellevue,WA,USA,Cigar,1 min,"While filming the crescent moon, I noticed a cigar shaped shadow about 1/4 of the way down creep up and out of sight.",5/12/09,
4/25/09 01:30,https://nuforc.org/webreports/reports/069/S69815.html,Palm Springs,CA,USA,Cigar,15 seconds,another craft sighting near the san jacinto mountains in california.,5/12/09,
4/24/09 00:12,https://nuforc.org/webreports/reports/069/S69786.html,Palm Bay,FL,USA,Cigar,continuing,Cigar shaped object and numerous small globe objects.,5/12/09,
4/22/09 16:00,https://nuforc.org/webreports/reports/079/S79853.html,West Chester,PA,USA,Cigar,5 seconds,My last sighting was not a hoax.,1/31/11,
4/22/09 16:00,https://nuforc.org/webreports/reports/069/S69775.html,West Chester,PA,USA,Cigar,5 seconds or less,Large grey cigar shaped object.,5/12/09,
4/20/09 06:30,https://nuforc.org/webreports/reports/069/S69791.html,Houston,TX,USA,Cigar,2 seconds,Glowing missile shaped object sited north of Houston IAH and heading towards earth.,5/12/09,
4/19/09 18:00,https://nuforc.org/webreports/reports/069/S69810.html,Zagreb (Croatia),,Croatia,Cigar,Few seconds,"White, moving slowly, gone behind the clouds.",5/12/09,
4/16/09 21:45,https://nuforc.org/webreports/reports/069/S69665.html,Las Vegas,NV,USA,Cigar,3 minutes,"This stuff is real! I, Mr.Non-believer, saw this. With my own eyes.",5/12/09,
4/5/09 02:45,https://nuforc.org/webreports/reports/069/S69631.html,Clarksville,MD,USA,Cigar,5 minutes,Large Mettalic Object making no sounds with red and green lights hovering by power lines moves away fast!,4/14/09,
4/4/09 15:20,https://nuforc.org/webreports/reports/069/S69542.html,Bristol,CT,USA,Cigar,3 minutes,i do not believe it was something from this planet...very strange.,4/14/09,
3/23/09 22:00,https://nuforc.org/webreports/reports/069/S69359.html,Canaan,NH,USA,Cigar,15-25 mins,"it was a cigar shaped UFO with three lights, two sometimes white or blue and one always red.",4/14/09,
3/19/09 17:00,https://nuforc.org/webreports/reports/069/S69300.html,In-flight sighting,,USA,Cigar,1 minutes,"Object spotted at 3600 feet, followed but a military jet.",4/14/09,
3/17/09 20:00,https://nuforc.org/webreports/reports/069/S69253.html,Largo,FL,USA,Cigar,10 seconds,Fast moving object with cyclic whistling noise.,3/19/09,
3/15/09 18:00,https://nuforc.org/webreports/reports/145/S145723.html,Peoria,NY,USA,Cigar,2 minutes,"In Peoria Arizona, I saw a cigar shaped craft floating above the neighborhood 500 feet up silent, emitted brilliant colors,",4/18/19,
3/14/09 18:30,https://nuforc.org/webreports/reports/069/S69395.html,Cancun (Mexico),,Mexico,Cigar,2 min,"cigar-shaped orange emitting light over the beach in Cancun, Mexico",4/14/09,
3/13/09 15:45,https://nuforc.org/webreports/reports/069/S69188.html,Miami,FL,USA,Cigar,,Large hovering metallic object in path of landing aircraft,3/19/09,
3/5/09 09:27,https://nuforc.org/webreports/reports/069/S69149.html,Durango/Pagosa Springs (between),CO,USA,Cigar,3-5 minutes,cigar shaped craft hovering over mountains,3/19/09,
2/27/09 01:30,https://nuforc.org/webreports/reports/068/S68972.html,Tahoe City,CA,USA,Cigar,5 seconds,fast moving object with flashing lights disappeared in 4-5 seconds,3/19/09,
2/26/09 20:15,https://nuforc.org/webreports/reports/068/S68966.html,Chino Valley,AZ,USA,Cigar,10 minutes,"Bright, horizontal , non-flashing , slow moving without tilting, landed on a mesa, lights dimmed.",3/19/09,
2/24/09 21:30,https://nuforc.org/webreports/reports/068/S68943.html,Dallas,NC,USA,Cigar,10 seconds,"To whom it may concern; I want to report a UFO sighting I witnessed on Jan.24th 2009 at 9:30 EST.

I live in Gaston County, N.C. out",3/19/09,
2/24/09 12:00,https://nuforc.org/webreports/reports/069/S69033.html,Tampa,FL,USA,Cigar,3 minutes,Wierd cigar shape flying object  with strange aura and no sound.,3/19/09,
2/15/09 11:30,https://nuforc.org/webreports/reports/075/S75713.html,Bellmont,AZ,USA,Cigar,1 hour,Shiny cigar craft north of I -40 az feb 2009,6/10/10,
2/14/09 00:00,https://nuforc.org/webreports/reports/068/S68684.html,"Smyrna Mills/Oakfield/Island Falls, and Patten",ME,USA,Cigar,A few seconds,"I personally, was driving home from a boyfriend's house while on the phone with him and noticed the sky light up bright blue for just a",3/19/09,
2/12/09 23:00,https://nuforc.org/webreports/reports/068/S68725.html,San Jacinto,CA,USA,Cigar,school,A CIGER SHAPE OBJECT AT SCHOOL !,3/19/09,
2/12/09 19:45,https://nuforc.org/webreports/reports/078/S78737.html,San Diego,CA,USA,Cigar,At least an hour,Confirm a report dated 02/12/09 in San Diego at approx 20:00 hrs.,11/21/10,
2/11/09 11:00,https://nuforc.org/webreports/reports/068/S68557.html,Essex,NC,USA,Cigar,20-30 seconds,Clear daylight sighting of a bright object which rapidly accelerated and disappeared.,3/19/09,
2/10/09 12:00,https://nuforc.org/webreports/reports/068/S68591.html,Hollister,NC,USA,Cigar,8-10 minutes,Brilliant silver vertical cigar shaped object moving  slowly which suddenly disappeared  followed by a big flash.,3/19/09,
2/8/09 17:50,https://nuforc.org/webreports/reports/068/S68523.html,West Branch,MI,USA,Cigar,6 seconds,saw an black object bisect the full moon and move downward in 6 seconds,3/19/09,
2/4/09 16:00,https://nuforc.org/webreports/reports/069/S69363.html,El Dorado,AR,USA,Cigar,1-2 min,narrow silver object moving rapidly south,4/14/09,
2/4/09 07:00,https://nuforc.org/webreports/reports/069/S69061.html,North Mobile County,AL,USA,Cigar,10 seconds,just at sun up at or near 7a.m. clear blue sky no clouds and a truly cigar shaped object that looked white to me like a belly of a fuel,3/19/09,
2/1/09 19:00,https://nuforc.org/webreports/reports/068/S68423.html,Robstown (north of; on IH 37),TX,USA,Cigar,6 minutes,viewed 1-4 cigar/disc shaped dark spots emitting no light nor sound for approximately 6 minutes,3/19/09,
1/28/09 17:00,https://nuforc.org/webreports/reports/068/S68303.html,Rio Rico,AZ,USA,Cigar,2minutes,u.f.o's in rio rico AZ,3/19/09,
1/25/09,https://nuforc.org/webreports/reports/068/S68314.html,Corona,CA,USA,Cigar,1 second,blue and green light surrounding cigar shaped object,3/19/09,
1/23/09 22:00,https://nuforc.org/webreports/reports/068/S68247.html,Boston,MA,USA,Cigar,30 minutes,"Two cigar shaped craft spotted lowering object into the boston side of the charles river.

 500 Lights On Object0: Yes",3/19/09,
1/20/09 17:00,https://nuforc.org/webreports/reports/068/S68156.html,"Washington, D.C.",DC,USA,Cigar,1 sec,I was watching this video on cnn.com look in the far right and watch object fly past sky infront of statue,3/19/09,
1/19/09 10:30,https://nuforc.org/webreports/reports/069/S69706.html,Playa del Rey,CA,USA,Cigar,1 hour,Saw a shape shifting UFO half the size of the moon over LAX,5/12/09,
1/18/09 23:00,https://nuforc.org/webreports/reports/068/S68146.html,Jacksonville Beach,FL,USA,Cigar,20 minutes,Glowing cigar shaped object creates intense glow in sky and move across ocean.,3/19/09,
1/18/09 00:00,https://nuforc.org/webreports/reports/068/S68807.html,Atlantic Ocean,,mid-Atlantic Ocean,Cigar,1-2 minutes,"3 unusual, brightly lit craft seen to be using cloud as cover in mid-Atlantic.",3/19/09,
1/16/09 07:40,https://nuforc.org/webreports/reports/068/S68308.html,Powdersville,SC,USA,Cigar,1 minute,cigar shape at 7:40 am just west of I-85 near Powdersville,3/19/09,
1/14/09 00:00,https://nuforc.org/webreports/reports/068/S68026.html,Winder,GA,USA,Cigar,3 minites,No noise and following each other,3/19/09,
1/2/09 04:05,https://nuforc.org/webreports/reports/067/S67815.html,Caro,MI,USA,Cigar,5 seconds,White cigar-shaped object dissappears after being sighted.,1/10/09,
1/1/09 18:00,https://nuforc.org/webreports/reports/070/S70161.html,Memphis,TN,USA,Cigar,30 minutes,Traveling red lights that had the ability to rapidly change flight direction were seen on Jackson Ave in Memphis TN,6/9/09,
1/1/09 17:00,https://nuforc.org/webreports/reports/070/S70820.html,Asheboro,NC,USA,Cigar,3-4 min.,Silver Cigar Shaped object at high altitude moving West.,8/5/09,
12/27/08 20:15,https://nuforc.org/webreports/reports/067/S67687.html,Spring Hill,FL,USA,Cigar,seconds,ufo over springhill florida,1/10/09,
12/27/08 13:19,https://nuforc.org/webreports/reports/068/S68059.html,Hudson Falls,NY,USA,Cigar,unknown,ufos land over hudson falls,3/19/09,
12/25/08 11:00,https://nuforc.org/webreports/reports/067/S67880.html,Swaffham (UK/England),,United Kingdom,Cigar,Photo,Photo Of  Small Object In The Sky On Christmas Morning 2008; Plane or UFO?,1/10/09,
12/24/08 07:18,https://nuforc.org/webreports/reports/067/S67673.html,Riverside,CA,USA,Cigar,1.25 minutes,"Two white, cigar shaped objects, pulsing with light.",1/10/09,
12/17/08 00:00,https://nuforc.org/webreports/reports/067/S67510.html,St. Petersburg,FL,USA,Cigar,3 frames,It just looks like it doesn`t belong there.,1/10/09,
12/14/08 10:30,https://nuforc.org/webreports/reports/068/S68305.html,Plainview,NY,USA,Cigar,30 to 40 seconds,"300 ft Cigar Shaped UFO traveling at Mach speed at approx. 15,000ft above Grumman in Bethpage, NY",3/19/09,
12/14/08 10:15,https://nuforc.org/webreports/reports/067/S67499.html,Bethpage,NY,USA,Cigar,1 minute,"Cigar shaped UFO over Long Island NY December, 14 2008",1/10/09,
12/7/08 23:00,https://nuforc.org/webreports/reports/067/S67365.html,Medi,PA,USA,Cigar,5 seconds,"was faceing west at a red light. cigar shaped craft moving north to south at incredible speed, 800+ easy,visable for only 7 seconds",1/10/09,
11/27/08 08:10,https://nuforc.org/webreports/reports/067/S67190.html,Los Angeles,CA,USA,Cigar,10 seconds,"Black saucer/cigar shaped object seen in west LA on November 27 2008 at apporximately 8:00 am.

 500 Lights On Object0: Yes",1/10/09,
11/25/08 16:31,https://nuforc.org/webreports/reports/067/S67140.html,Deming,WA,USA,Cigar,10 seconds,"Long siler, sparkely object in Deming.",1/10/09,
11/25/08 00:00,https://nuforc.org/webreports/reports/067/S67153.html,Huntsville,TX,USA,Cigar,7.30 min,Cigar shaped UFO's sighted and investigated as they traveled at a high rate of speed.,1/10/09,
11/23/08 01:32,https://nuforc.org/webreports/reports/067/S67099.html,Leesburg,GA,USA,Cigar,5 seconds,Fast moving object seen in Leesburg Ga that does not resemble anything known.,1/10/09,
11/21/08 13:49,https://nuforc.org/webreports/reports/067/S67119.html,Dyersburg,TN,USA,Cigar,1 MINUTE,"I was in a vehicle on an exit ramp on I-155w waiting at a stop sign to turn left onto lake rd.(hwy 78) in dyersburg, tn.  I noticed a l",1/10/09,
11/19/08 22:10,https://nuforc.org/webreports/reports/067/S67013.html,Tuscaloosa,AL,USA,Cigar,2 seconds,large blue bullet shaped object crossing sky of tuscaloosa alabama,1/10/09,
11/19/08 05:20,https://nuforc.org/webreports/reports/066/S66994.html,New Hope,PA,USA,Cigar,20+ minutes,a bright 'falling' star that didn't fall but had trails of vapor and revolved so I could see the cigar or disk shape.,1/10/09,
11/16/08 14:10,https://nuforc.org/webreports/reports/066/S66939.html,Park City,UT,USA,Cigar,,"2 half domes with the flat side of the domes faseing each other, blue sky could be seen in the space between the two flat services.  ab",1/10/09,
11/15/08 17:20,https://nuforc.org/webreports/reports/066/S66925.html,Bellingham-Lummi,WA,USA,Cigar,25minutes,11/15/08' Lummi nation two flying orange cigar shaped objects flew and criss- crossed over our bay then dissapeared,1/10/09,
11/14/08 10:00,https://nuforc.org/webreports/reports/067/S67502.html,El Paso (Fort Bliss),TX,USA,Cigar,10 minutes,Cigar-shaped UFO moving south-southwest towards Mexico,1/10/09,
11/12/08 22:09,https://nuforc.org/webreports/reports/067/S67196.html,Bloomfield Hills,MI,USA,Cigar,35 minutes,long blue cigar shape moving up into sky,1/10/09,
11/12/08 16:10,https://nuforc.org/webreports/reports/070/S70222.html,Randolph,MA,USA,Cigar,2 sec,Possible Tomahawk Missile,6/9/09,
11/8/08 12:00,https://nuforc.org/webreports/reports/067/S67511.html,Wilmer,TX,USA,Cigar,1:00,Cigar shaped craft seen hovering over Texas at noon,1/10/09,
11/8/08 06:00,https://nuforc.org/webreports/reports/066/S66782.html,Trabuco Canyon,CA,USA,Cigar,15 minutes,several UFOs sighted in trabuci canyon,1/10/09,
11/1/08 10:05,https://nuforc.org/webreports/reports/066/S66720.html,Osceola,NE,USA,Cigar,30 sec,"me and my brother were driveing down a gravel road when we seen this object, and aour car turned off, i have seen several other ocasion",1/10/09,
10/30/08 07:00,https://nuforc.org/webreports/reports/066/S66560.html,Furlong,PA,USA,Cigar,3-4 minutes,1 chrome cigar shaped object,10/31/08,
10/24/08 19:30,https://nuforc.org/webreports/reports/066/S66439.html,Burien,WA,USA,Cigar,5 min,"My wife and I were driving back from Trader Joe's when she spotted some lights not moving,just hovering in mid air.I thought she was de",10/31/08,
10/19/08 11:00,https://nuforc.org/webreports/reports/066/S66740.html,Gainesville,VA,USA,Cigar,3 minutes,Matellic Object Seen In Gainsville Virginia,1/10/09,
10/14/08 20:30,https://nuforc.org/webreports/reports/066/S66230.html,Rapid City,SD,USA,Cigar,ongoing,North east sky.  ((NUFORC Note:  Star??  PD)),10/31/08,
10/12/08 08:00,https://nuforc.org/webreports/reports/066/S66202.html,Russellton,PA,USA,Cigar,50 Seconds,"Cigar shaped, low flying, and decent size craft blicking red light.",10/31/08,
10/9/08 10:36,https://nuforc.org/webreports/reports/066/S66138.html,Asbury,NJ,USA,Cigar,10 seconds,a white cigar-shaped object very high in the sky,10/31/08,
10/8/08 20:35,https://nuforc.org/webreports/reports/066/S66119.html,Stafford Springs,CT,USA,Cigar,3 minutes,"a string of four white lights, third one blinking white, appeared about 30 feet above me about 20 feet away from me  in front of me",10/31/08,
10/6/08 11:00,https://nuforc.org/webreports/reports/066/S66705.html,Conshohocken,PA,USA,Cigar,10 minutes,"A silver cigar shaped object remained stationary very high over head,well above the horizon close to zenith in the western sky for abou",1/10/09,
10/3/08 10:25,https://nuforc.org/webreports/reports/066/S66035.html,Lincolnton,NC,USA,Cigar,about 5 min,"cigar shaped ufo in daylight, clear sky!!!!!",10/31/08,
10/1/08 11:00,https://nuforc.org/webreports/reports/072/S72591.html,Pell City,AL,USA,Cigar,5 Min.,"Very high, cigar shaped UFO moving at incredible speeds.",12/12/09,
9/21/08 19:40,https://nuforc.org/webreports/reports/065/S65837.html,Palm Coast,FL,USA,Cigar,1 minute,WE SAW A GLOW AND THEN A CRAFT TO THE RIGHT OF THE GLOW IN THE CLOUDS.,10/31/08,
9/21/08 02:58,https://nuforc.org/webreports/reports/065/S65809.html,St. Louis,MO,USA,Cigar,26seconds,A cigar shaped ufo was hovering over the mississippi river then went straight up and was gone. WOW!!!!!!!!!!!!!!!!!!!!!!!!!!!!!!!!!!!!!,10/31/08,
9/20/08 21:15,https://nuforc.org/webreports/reports/065/S65802.html,Capistrano Beach,CA,USA,Cigar,15 minutes,Rotating tall objects sighted over South Orange County Southern California with no sound.,10/31/08,
9/19/08 11:00,https://nuforc.org/webreports/reports/065/S65776.html,Flushing,NY,USA,Cigar,30 seconds,"Two crafts moving over Flushing, NY",10/31/08,
9/10/08 09:50,https://nuforc.org/webreports/reports/065/S65629.html,Woodland Hills,CA,USA,Cigar,5 seconds,Daylight Cigar / Cylinder Shape Flying Object,10/31/08,
9/9/08 18:35,https://nuforc.org/webreports/reports/065/S65622.html,Medford,OR,USA,Cigar,4 minutes,Cigar shaped object viewed through binoculars over Medford,10/31/08,
9/6/08 23:30,https://nuforc.org/webreports/reports/065/S65586.html,Paso Robles,CA,USA,Cigar,12 seconds,fireball followed by unusual aircraft,10/31/08,
8/31/08 20:55,https://nuforc.org/webreports/reports/065/S65557.html,Mesa,AZ,USA,Cigar,90 minutes,"At sunset, a large cloud approached from the SW to a pos. approx. 10 km from us.  ((NUFORC Note:  We see clouds only.   PD))",10/31/08,
8/26/08 16:30,https://nuforc.org/webreports/reports/065/S65461.html,Johnson City,NY,USA,Cigar,20 sceonds,"Silver cigar shaped craft sighted flying over Binghamton, NY, headed towards Chenango bridge/chenango Forks area.",10/31/08,
8/26/08 07:30,https://nuforc.org/webreports/reports/065/S65485.html,Springtown,TX,USA,Cigar,10 min,This is SCARY,10/31/08,
8/24/08 18:00,https://nuforc.org/webreports/reports/065/S65393.html,Gardena,CA,USA,Cigar,3 minutes,White/Silver cigar shaped craft dissappears behind powerlines,10/31/08,
8/24/08 17:32,https://nuforc.org/webreports/reports/067/S67481.html,Lincoln,NE,USA,Cigar,23 Minutes,"The UFO had blue and yellow alternating lights, cigar shaped, and suddenly changed directions.",1/10/09,
8/20/08 20:00,https://nuforc.org/webreports/reports/065/S65332.html,Lumberton,NC,USA,Cigar,20 Seconds,"I was taking a walk when i looked up to see a shiny bolt, which was no airplane.",10/31/08,
8/17/08 19:00,https://nuforc.org/webreports/reports/065/S65290.html,Wauconda,IL,USA,Cigar,2 minutes?,Bright silver cigar-shape ( no visible wings ) moving towards the N.East. viewed over Bangs Lake.,10/31/08,
8/12/08 21:30,https://nuforc.org/webreports/reports/065/S65232.html,Utuado (Puerto Rico),,Puerto Rico,Cigar,10 seconds,((HOAX??))  A cigar shaped craft with three bright lights that stood still and vanished without making any noise.,10/31/08,
8/10/08 13:45,https://nuforc.org/webreports/reports/065/S65149.html,St. Louis,MO,USA,Cigar,20-30 mins,Black spot low on South St. Louis sky,8/12/08,
8/10/08 13:00,https://nuforc.org/webreports/reports/073/S73242.html,St. Louis,MO,USA,Cigar,1 hour,MISSOURI INVESTIGATORS GROUP Report:  I saw a black metallic cigar shaped object. It moved slowly and was silent.,12/12/09,
8/10/08 01:30,https://nuforc.org/webreports/reports/065/S65166.html,Houston,TX,USA,Cigar,seconds,"Extremely bright, cigar shaped object in the night sky near down town Houston.",8/12/08,
8/7/08 22:00,https://nuforc.org/webreports/reports/065/S65173.html,Beach Park,IL,USA,Cigar,2 minutes,Disappearing cigar shape,8/12/08,
8/7/08 09:43,https://nuforc.org/webreports/reports/065/S65241.html,Paso Robles,CA,USA,Cigar,30 seconds,A silver shiny cigar shaped object hovering 300 ft above the ground in Paso Robles.,10/31/08,
8/4/08 19:00,https://nuforc.org/webreports/reports/065/S65008.html,Canton,MA,USA,Cigar,10 seconds,Unidentified Flying object  spotted in the sky in massachussetts,8/12/08,
8/3/08 22:00,https://nuforc.org/webreports/reports/064/S64994.html,Scotch Plains,NJ,USA,Cigar,2 sec,UFO Sighting in Central NJ,8/12/08,
8/3/08 13:00,https://nuforc.org/webreports/reports/077/S77497.html,Bellingham,WA,USA,Cigar,not sure,cigar ship caught on a  picture on a whale watching tour.,8/30/10,
7/28/08,https://nuforc.org/webreports/reports/064/S64873.html,Honolulu,HI,USA,Cigar,15 min,"Sightings I will write down everything I remember from that day. It was a Monday, 28th of July.  My daughter & I had errans to run that",8/12/08,
7/27/08 14:15,https://nuforc.org/webreports/reports/065/S65035.html,Brean (Sommerset) (UK/England),,United Kingdom,Cigar,12 minutes,"cigar shaped object or rod shaped u.f.o spotted over brean, sommerset, united kingdom",8/12/08,
7/23/08 18:00,https://nuforc.org/webreports/reports/073/S73249.html,Columbia,MO,USA,Cigar,5 minutes,"MISSOURI INVESTIGATORS GROUP Report:  I WAS IN MY BACK YARD, I LOOKED UP AND SAW A SILVER CIGAR SHAPE OBJECT.",12/12/09,
7/23/08 18:00,https://nuforc.org/webreports/reports/073/S73406.html,Columbia,MO,USA,Cigar,5 minutes,MISSOURI INVESTIGATORS GROUP Report::  I LOOKED UP AND SAW A SILVER CIGAR SHAPE OBJECT TRAVELING WEST TO EAST.,12/12/09,
7/19/08 14:00,https://nuforc.org/webreports/reports/064/S64685.html,Mumford,NY,USA,Cigar,1/30 second,My camera picked up a rod-like craft or object.,8/12/08,
7/15/08 19:45,https://nuforc.org/webreports/reports/064/S64582.html,Phoenix,AZ,USA,Cigar,10 MINUTES,Glowing Cigar  over the Lake Pleasnat ranges.,8/12/08,
7/15/08 15:00,https://nuforc.org/webreports/reports/075/S75470.html,Shamokin (Coal Township),PA,USA,Cigar,5 seconds,Saw a white flatish oval or cigar shaped white object for 5 seconds and then it disappeared. Clear blue sky with no clouds.,6/3/10,
7/15/08 01:00,https://nuforc.org/webreports/reports/064/S64574.html,Richmond,KY,USA,Cigar,1:00,very short but still  wierd,8/12/08,
7/13/08 20:35,https://nuforc.org/webreports/reports/064/S64527.html,Grants Pass,OR,USA,Cigar,3 minutes,"strange object seen in Grants Pass, Oregon",8/12/08,
7/4/08 23:00,https://nuforc.org/webreports/reports/065/S65487.html,Conneaut,OH,USA,Cigar,10 second's,"UFO SPOTTED  JULY,04,2008 IN CONNEAUT,OHIO   ((NUFORC Note:  Possible hoax??  PD))",10/31/08,
