date,reportlink,city,state,country,shape,duration,description,post_date,images
7/24/23 21:53,https://nuforc.org/webreports/reports/176/S176983.html,Stone harbor,NJ,USA,Cigar,10 seconds,4 cigar shaped lights moving across the sky viewed through a telescope moving to fast for a comet but to slow for a satellite or meteor,7/29/23,Yes
7/20/23 22:24,https://nuforc.org/webreports/reports/176/S176852.html,Bellevue,WA,USA,Cigar,5+ minutes,Hovering Craft Above Downtown Bellevue,7/29/23,Yes
7/19/23 07:27,https://nuforc.org/webreports/reports/176/S176844.html,Lemon Grove,CA,USA,Cigar,2 minutes?,object had 'fins' so not an airplane,7/29/23,Yes
7/17/23 10:27,https://nuforc.org/webreports/reports/176/S176877.html,Sullivan,MO,USA,Cigar,30 seconds to a minute,We saw a long white tic tax type cylinder with rounded edges hovering above the tree line.,7/29/23,
7/16/23 08:40,https://nuforc.org/webreports/reports/176/S176805.html,Winnemucca,NV,USA,Cigar,8 minutes,Large cigar shaped object floating left to right across the sky at high altitude,7/29/23,Yes
7/13/23 20:21,https://nuforc.org/webreports/reports/176/S176751.html,North haven,CT,USA,Cigar,30 seconds,The craft was white almost like a tic tac that moved slow and steady went behind a cloud and disappeared.,7/29/23,
7/12/23 12:08,https://nuforc.org/webreports/reports/176/S176776.html,London,London Borough of Croydon,United Kingdom,Cigar,(Observed for) 13 minutes,Cigar or disk hiding in clouds,7/29/23,Yes
7/11/23 21:50,https://nuforc.org/webreports/reports/176/S176710.html,St Catharines,ON,Canada,Cigar,5-10 Minutes,Black sick looking object in the sky right now!,7/29/23,
7/11/23 04:44,https://nuforc.org/webreports/reports/176/S176790.html,MALAGA,Málaga Province,Spain,Cigar,,"I was taking a photo of the moon, saw the ufo decided to keep moon shot in the centre, to help prospective, this is facing south",7/29/23,Yes
7/10/23 20:29,https://nuforc.org/webreports/reports/176/S176695.html,Defiance,MO,USA,Cigar,2-3 mins,Witnessed a tic-tac/cigar shaped object while taking my dog out,7/29/23,Yes
7/1/23 21:57,https://nuforc.org/webreports/reports/176/S176597.html,Eden Prairie,MN,USA,Cigar,15 seconds,Craft moved at high speed traveling south directly at my House and camera them made an abrupt turn to the west.,7/10/23,
7/1/23 21:33,https://nuforc.org/webreports/reports/176/S176562.html,Shenandoah,VA,USA,Cigar,Less than 1 second,"Recording neighbors fireworks and a green light cut across the sky, saw it with my naked eye too just wasnt sure what it was right away",7/10/23,Yes
6/30/23 01:26,https://nuforc.org/webreports/reports/176/S176526.html,Keizer,OR,USA,Cigar,A few seconds,"An object gliding fast in the sky, no lights greyish brown color. Looked as if there was some texture to it , I saw it disappear.",7/10/23,
6/25/23 23:15,https://nuforc.org/webreports/reports/176/S176461.html,Bellevue,WA,USA,Cigar,30 seconds,Bellevue UFO,7/10/23,Yes
6/25/23 18:41,https://nuforc.org/webreports/reports/176/S176494.html,Riverside,RI,USA,Cigar,2 minutes,Noticed a stationary object above the tree line,7/10/23,Yes
6/24/23 18:45,https://nuforc.org/webreports/reports/176/S176452.html,Coupeville,WA,USA,Cigar,5 seconds,"I saw what I thought was a plane flying in the distance, I watched it for about 4 seconds when it abruptly disappeared.",7/10/23,
6/22/23 23:22,https://nuforc.org/webreports/reports/176/S176413.html,Grand Rapids,MI,USA,Cigar,30 seconds,I saw a very large cigar shaped craft passing overhead.,7/10/23,
6/22/23 22:18,https://nuforc.org/webreports/reports/176/S176414.html,New Castle,CO,USA,Cigar,30 seconds,"Ocean freighter size craft floated by, good video of blinking lights",7/10/23,
6/18/23 23:50,https://nuforc.org/webreports/reports/176/S176350.html,Leipzig,Saxony,Germany,Cigar,10 min,Still green streaks,7/10/23,Yes
6/14/23 22:41,https://nuforc.org/webreports/reports/176/S176286.html,Longview,WA,USA,Cigar,One minute,"Massive and loud aircraft sped unusually close to residential neighborhood, spotlight searching from the fore.",7/10/23,
6/12/23 22:45,https://nuforc.org/webreports/reports/176/S176233.html,Oakton,VA,USA,Cigar,4 minutes,"String of object(s) was 15 miles out and 2 miles up, moving west to east then headed north where only the tail end showed.",7/10/23,
6/12/23 22:20,https://nuforc.org/webreports/reports/176/S176261.html,Joshua Tree,CA,USA,Cigar,10 minutes or less,UAP seen less the 100ft off ground shaped like a cigar shaped harmonica,7/10/23,
6/10/23 21:55,https://nuforc.org/webreports/reports/176/S176160.html,Zebbug,Zebbug Malta,Malta,Cigar,45 seconds,I was having fun with my friends in zebbug for to explore fireworks I noticed there is shinning cigar type object flying near fireworks,7/10/23,Yes
6/9/23 18:43,https://nuforc.org/webreports/reports/176/S176421.html,Wasilla,AK,USA,Cigar,45 seconds,Very Bright large cigar shaped object appeared in NW airspace hovered about 45 seconds then disappeared.,7/10/23,
6/5/23 09:28,https://nuforc.org/webreports/reports/176/S176026.html,Rio Rancho,NM,USA,Cigar,seconds,Chromish object from south to southwest,7/10/23,
6/1/23 04:30,https://nuforc.org/webreports/reports/176/S176010.html,Rome,GA,USA,Cigar,Approximately 5 minutes,Oblong craft shining green laser,7/10/23,
5/31/23 18:00,https://nuforc.org/webreports/reports/176/S176850.html,"Oakenshaw, Low Moor, Wibsey",Bradford,United Kingdom,Cigar,Approx 2 minutes,At approx 1800hrs this evening myself and my partner witnessed a UFO going across the sky high above Oaken,7/29/23,
5/30/23 21:57,https://nuforc.org/webreports/reports/175/S175987.html,Herington,KS,USA,Cigar,15 seconds,Appears to be controlled flight with non wavering light emitted. Missile possible but big full body,7/10/23,
5/25/23 19:56,https://nuforc.org/webreports/reports/175/S175958.html,Hope,ID,USA,Cigar,10 seconds,"A cigar shaped very illuminated yellow white and iridescent light ship traveling rapidly to the south west, coming out of the north.",7/10/23,Yes
5/25/23 19:26,https://nuforc.org/webreports/reports/175/S175956.html,Liberty,UT,USA,Cigar,1 second,I was recording lightning and played it back and saw something fly through the lightning as it flashed,7/10/23,Yes
5/24/23 09:06,https://nuforc.org/webreports/reports/175/S175905.html,Portland,OR,USA,Cigar,30 seconds,"Walking dog, looked up and saw object drifting, then noticed secondary object drifting in opposing direction.",7/10/23,Yes
5/22/23 19:40,https://nuforc.org/webreports/reports/175/S175881.html,Kelseyville,CA,USA,Cigar,15 Seconds,Cigar shaped craft in the southern sky,7/10/23,Yes
5/20/23 22:08,https://nuforc.org/webreports/reports/175/S175914.html,Round Mountain,CA,USA,Cigar,About 1 to 2 minutes,Bright and dimmer lights moving in sequence then disappeared and after they were gone random blinking lights in various parts of sky,7/10/23,
5/18/23 13:27,https://nuforc.org/webreports/reports/175/S175836.html,Hurricane,UT,USA,Cigar,10 minutes,Saw what looked like a long cigar shaped object and another tiny flashing light zipping around it.,5/19/23,
5/15/23 18:10,https://nuforc.org/webreports/reports/175/S175807.html,Athabasca,AB,Canada,Cigar,,Sitting outside saw something in the sky not a airplane took a video,5/19/23,
5/14/23 22:00,https://nuforc.org/webreports/reports/175/S175796.html,"Brodheadsville, PA",PA,USA,Cigar,2 minutes,"150ft+ maybe bigger Transparent single ufo with lights disappears above heads, below and behind plane",5/19/23,
5/6/23 08:46,https://nuforc.org/webreports/reports/175/S175679.html,Fairfax,VA,USA,Cigar,4 seconds,"Object initially appeared dark and spherical, but quickly turned, revealing that it was dull gray and cigar-like",5/19/23,
5/4/23 21:45,https://nuforc.org/webreports/reports/175/S175627.html,Hickory,NC,USA,Cigar,5 minutes,west heading east looked like a pencil shape with solid lights maybe 6 feet apart object seemed a mile away and mile up no sound,5/19/23,
4/30/23 21:29,https://nuforc.org/webreports/reports/175/S175581.html,Homestead,,,Cigar,2 minutes,The object couldn't have been a meteor because of its long duration in the sky. The object was bright orange but didnt light up the sky,5/19/23,
4/20/23 12:12,https://nuforc.org/webreports/reports/175/S175494.html,Paulina,LA,USA,Cigar,1 min,"I was at work on the mississippi river in paulina, la and i picked my head up and saw 2 crafts with no wings.",5/19/23,
4/19/23 19:42,https://nuforc.org/webreports/reports/175/S175428.html,San Clemente,CA,USA,Cigar,15 seconds,Thing moving across the water unnaturally,5/19/23,
4/16/23 12:00,https://nuforc.org/webreports/reports/175/S175407.html,Nashville,TN,USA,Cigar,15 minutes,"April 16, 2023, around 12 p.m., a large object reflected or shined light toward me. It was stationary and at a very high altitude.",5/19/23,
3/23/23 20:01,https://nuforc.org/webreports/reports/175/S175101.html,Chesnee,SC,USA,Cigar,Less than 1 minute,Just taking pictures of the moon and Jupiter,4/9/23,Yes
3/17/23 21:43,https://nuforc.org/webreports/reports/175/S175039.html,Redwood valley ca,CA,USA,Cigar,15seconds,Seen this slow moving long set of lights hovering across sky was pretty long forsure then once across the ski dissapered,4/9/23,
3/13/23 23:00,https://nuforc.org/webreports/reports/175/S175025.html,Bellevue,,USA,Cigar,30 seconds,Cigar-shaped aircraft (not an airplane),4/9/23,Yes
3/9/23 19:37,https://nuforc.org/webreports/reports/174/S174960.html,Opelika,AL,USA,Cigar,It was just there.we left,Bright hovering long object,4/9/23,
2/28/23 18:27,https://nuforc.org/webreports/reports/174/S174785.html,Belkevue,WA,USA,Cigar,30 seconds,Unidentified aircraft (possibly manned),3/6/23,Yes
2/14/23 08:04,https://nuforc.org/webreports/reports/174/S174548.html,Miami,FL,USA,Cigar,20 to 25 seconds,The sky was blue and clear and from a distance as I was driving onto campus from SW 107th Ave. & 18th Street I spotting this object,3/6/23,Yes
2/13/23 14:50,https://nuforc.org/webreports/reports/174/S174516.html,Corona,CA,USA,Cigar,Approximately 5 minutes,Happened to notice this object slowing moving westbound as I was traveling eastbound on the 91 freeway toward Riverside.,3/6/23,
2/12/23 19:38,https://nuforc.org/webreports/reports/174/S174461.html,Twinsburg,OH,USA,Cigar,About 3 minutes,A line of bright lights that was constant; couldn't see the craft disappeared right above me,3/6/23,
2/11/23 18:45,https://nuforc.org/webreports/reports/174/S174478.html,Walla Walla,WA,USA,Cigar,5 seconds,A thin pale yellow glowing line appeared mid-sky and glided in a perfectly straight line due north for about 5 seconds.,3/6/23,
2/11/23 17:15,https://nuforc.org/webreports/reports/174/S174450.html,Lexington,VA,USA,Cigar,4 minutes,"A white cylinder, rounded on both ends, about 5 or 6 times longer than wide. No wings, no contrail, no sound.",3/6/23,
2/10/23 18:11,https://nuforc.org/webreports/reports/174/S174621.html,My Pleasant,UT,USA,Cigar,At least 45 min,2 Large cigars/saucers over the mountain,3/6/23,
2/9/23 17:30,https://nuforc.org/webreports/reports/174/S174375.html,Applegate,OR,USA,Cigar,20 mins,"A fleet appeared flying northeast in the sky equidistance apart, some looping back. We have 5-6 mins of video",3/6/23,
2/9/23 16:00,https://nuforc.org/webreports/reports/174/S174428.html,"South East of Quartzite, AZ",AZ,USA,Cigar,5 minutes,"It was daylight and no clouds. I spotted a large object to the southeast moving east.it was moving slow, it was black, it was large.",3/6/23,Yes
2/8/23 09:31,https://nuforc.org/webreports/reports/174/S174503.html,Paradise Mt. Rainier National Park,WA,USA,Cigar,one screen shot,The photo has great detail if blown up.,3/6/23,Yes
2/5/23 22:00,https://nuforc.org/webreports/reports/174/S174477.html,McKinney,TX,USA,Cigar,5+ Minutes,Observed a Illuminated Cigar Shaped UAP,3/6/23,
2/3/23 19:40,https://nuforc.org/webreports/reports/174/S174311.html,Brooksville,FL,USA,Cigar,2 minutes,A straight line of lights. The length of multiple full train cars. Still at first then took off fast and disappeared into thin air,3/6/23,
2/1/23 20:17,https://nuforc.org/webreports/reports/174/S174234.html,Melbourne,Victoria,Australia,Cigar,1 sec,"Was in my backyard started taking photos of funny looking clouds then as I looked over them I captured quite a few , samsung S22ultra",3/6/23,Yes
1/28/23 20:39,https://nuforc.org/webreports/reports/174/S174180.html,"Littlestown,",PA,USA,Cigar,15 minutes,Weird object hanging in sky with lights all around,3/6/23,
1/26/23 20:24,https://nuforc.org/webreports/reports/174/S174193.html,French Settlement,LA,USA,Cigar,About 5 seconds.,A tic tak shaped craft. That was seen for about 5 seconds.,3/6/23,
1/25/23 17:55,https://nuforc.org/webreports/reports/174/S174133.html,El cerrito,CA,USA,Cigar,3 minutes,"Craft moved from the golden gate towards the south bay, pen shaped semi translucent grey in color, single blinking white light at tip",3/6/23,
1/19/23 20:06,https://nuforc.org/webreports/reports/174/S174024.html,Roodepoort,Gauteng,South Africa,Cigar,44.sec,I saw it and I called my friends to come see as the cigar made no noise passing above us,3/6/23,
1/15/23 17:09,https://nuforc.org/webreports/reports/174/S174020.html,Kingsville,MD,USA,Cigar,Unclear. We were driving,"6 bright lights suddenly appeared, had a tail of light and suddenly disappeared",3/6/23,Yes
1/14/23 19:25,https://nuforc.org/webreports/reports/174/S174249.html,Rock island and cookeville,TN,USA,Cigar,3 hours,It scared us bc it watched us and followed us 45 miles to cookeville,3/6/23,
1/12/23 18:08,https://nuforc.org/webreports/reports/174/S174623.html,,,USA,Cigar,7 or more,There was one triangle shaped craft and many dots around it.,3/6/23,Yes
1/12/23 00:30,https://nuforc.org/webreports/reports/173/S173942.html,Winston-Salem,NC,USA,Cigar,1-2 minutes,"My sister and I heard low humming that shook the house at around 12:30 AM, my sister viewed the cigar shaped craft go over some trees.",3/6/23,
1/11/23 19:55,https://nuforc.org/webreports/reports/173/S173862.html,Palm Bay,FL,USA,Cigar,15 seconds,Bright green object flew over house,3/6/23,
1/10/23 07:15,https://nuforc.org/webreports/reports/173/S173879.html,Salem,OR,USA,Cigar,15 minutes,Large fat cigar shaped 2 miles south of Salem hovering with 2 large lights light head lights thought it was a bus size drone,3/6/23,
1/5/23 07:30,https://nuforc.org/webreports/reports/173/S173749.html,Longview,NC,USA,Cigar,3 minutes,"Pill shaped object, looked like a blinking star.",3/6/23,Yes
1/3/23 23:30,https://nuforc.org/webreports/reports/173/S173778.html,New Castle,PA,USA,Cigar,20 mins,25 Cigar Bright Shaped high as plane,3/6/23,
1/2/23 01:00,https://nuforc.org/webreports/reports/174/S174125.html,Albany,NY,USA,Cigar,3-5 minutes,Object came down from the sky,3/6/23,
1/1/23 16:45,https://nuforc.org/webreports/reports/173/S173705.html,Clovis,NM,USA,Cigar,15 mins before dark,Cigar shape bobbed in & out of clouds in place.,3/6/23,
12/28/22 17:03,https://nuforc.org/webreports/reports/173/S173622.html,"Arrington, Tennessee",TN,USA,Cigar,20 minutes,Cigar-shaped black object floating high in the sky without disappearing or significantly moving. Caught on film.,3/6/23,
12/27/22 17:30,https://nuforc.org/webreports/reports/173/S173613.html,,,USA,Cigar,Less than a second,I was testing my new canon camera.,3/6/23,Yes
12/25/22 12:30,https://nuforc.org/webreports/reports/173/S173566.html,Franklin,TN,USA,Cigar,about 30-45 seconds,Shiny silver cigar craft with a clear blue sky. Had 2 very small wings like a government drone but hovered and disappeared.,3/6/23,
12/17/22 18:45,https://nuforc.org/webreports/reports/173/S173513.html,Oklahoma City,OK,USA,Cigar,About a minute,"While getting ready to take off from PWA, I looked to the NW (wearing NVGs) and saw an elongated oval shaped object",12/22/22,
12/17/22 18:05,https://nuforc.org/webreports/reports/173/S173452.html,Sterlng,CO,USA,Cigar,15-25 seconds,"LONG illuminated ""cigar"" shaped craft that appeared from nowhere moving as one craft until fading out quickly",12/22/22,
12/17/22 16:42,https://nuforc.org/webreports/reports/173/S173454.html,Westcliffe,CO,USA,Cigar,1.5 minutes,While sitting in our hot tub on outdoors deck we noticed a definitively cigar shaped craft moving across the sky.,12/22/22,
12/10/22 15:30,https://nuforc.org/webreports/reports/173/S173824.html,"Mead,",WA,USA,Cigar,25 seconds,"Highly reflective silver objects in the sky not that far in the sky. We saw it, and watched it for a few seconds before it disappeared",3/6/23,
12/10/22 06:25,https://nuforc.org/webreports/reports/173/S173362.html,Orefield,PA,USA,Cigar,5 seconds,Massive obsidian coloured cigar shaped object,12/22/22,
12/9/22 04:30,https://nuforc.org/webreports/reports/173/S173603.html,Lantana,FL,USA,Cigar,3minu,Looking east seen off white cigar shape object that 1st blended in with clouds,3/6/23,
12/7/22 16:48,https://nuforc.org/webreports/reports/173/S173319.html,Reno,NV,USA,Cigar,2 full minutes,"I went to my hotel room, looked outside and saw a cigar shaped object emitting bright orange light",12/22/22,
12/4/22 21:05,https://nuforc.org/webreports/reports/174/S174109.html,Odessa,FL,USA,Cigar,10 seconds,Appeared suddenly and hovered for about 10 seconds before dissapearing.,3/6/23,Yes
12/1/22 22:00,https://nuforc.org/webreports/reports/174/S174460.html,Chokoloskee,FL,USA,Cigar,Only seconds maybe 4 seco,"It was huge craft , the size of a large ship, 500 to 1,000 ft long.",3/6/23,
11/17/22 22:38,https://nuforc.org/webreports/reports/173/S173616.html,Myrtle Beach,SC,USA,Cigar,Didnt notice at first,I didnt notice the object at first. I was taking a photo of my view from my back patio to send a friend.,3/6/23,Yes
11/16/22 17:30,https://nuforc.org/webreports/reports/173/S173091.html,Wilmington,NC,USA,Cigar,<20 seconds,Observed a very slow moving unmarked cigar tube shaped craft moving in the air at very low altitude in straight East to West direction,12/22/22,
11/16/22 13:32,https://nuforc.org/webreports/reports/173/S173056.html,Scottsdale,AZ,USA,Cigar,10 seconds,"A bright silver cigar shaped object was floating, completely motionless in the sky and then disappeared in about 10 seconds",12/22/22,Yes
11/14/22 16:40,https://nuforc.org/webreports/reports/173/S173014.html,Philadelphia,PA,USA,Cigar,About 5 minutes still.,I was driving seen 5 lights in sky not moving. got out of car took pictures.,12/22/22,Yes
11/12/22 08:01,https://nuforc.org/webreports/reports/173/S173231.html,baltiomre,MD,USA,Cigar,22 seconds,i was getting out of my car looked up and saw a stationary weird thing,12/22/22,
11/11/22 20:23,https://nuforc.org/webreports/reports/172/S172887.html,Needles,CA,USA,Cigar,1 hour,"2008 ufo crash,in needles,I found the crash site,pieces of the ufo,and the pilot survived and is living in the desert 2 this day.,",12/22/22,
11/10/22 16:38,https://nuforc.org/webreports/reports/173/S173178.html,Pendleton,OR,USA,Cigar,several minutes,"While driving west near sunset, I saw a stationary vertical object in the sky.",12/22/22,
11/5/22 20:50,https://nuforc.org/webreports/reports/172/S172839.html,Zephyrhills,FL,USA,Cigar,5 seconds or so,rocket like object appeared in night sky and then red and white light was emitted around the object in a slim parabola shape,12/22/22,Yes
10/29/22 19:00,https://nuforc.org/webreports/reports/172/S172760.html,Port charlotte,FL,USA,Cigar,20-25min,Saw 4 unidentified objects in they sky over a 20 min period,12/22/22,
10/29/22 16:27,https://nuforc.org/webreports/reports/172/S172727.html,Allumette Island Quebec,Quebec,Canada,Cigar,15-25 seconds,Very large cigar shaped craft traveling quickly in an eastern direction,12/22/22,Yes
10/27/22 19:10,https://nuforc.org/webreports/reports/172/S172608.html,Brewerton,NY,USA,Cigar,5-10 mins,Out for my even walk and saw a long shaped craft moving very slowly and hovering near Oneida Lake,12/22/22,
10/27/22 07:29,https://nuforc.org/webreports/reports/172/S172599.html,Raleigh,,USA,Cigar,1-3 minutes,6 craft all having 1 green light. 2 stopped in the air then sped up rapidly and passed the other 4. Fireball then everything gone.,12/22/22,
10/27/22 04:58,https://nuforc.org/webreports/reports/172/S172686.html,Northern Myrtle Beach,SC,USA,Cigar,saw it for approx 10 min,I thought it was a bright star until it moved sideways and forward very quickly,12/22/22,Yes
10/20/22 20:22,https://nuforc.org/webreports/reports/172/S172443.html,Jacksonville,FL,USA,Cigar,5 minutes,"Cigar shaped craft no sound, bright, nothing carrying it, began to move when I started filming and faded out into thin air",12/22/22,Yes
10/20/22 19:30,https://nuforc.org/webreports/reports/172/S172466.html,jackson,AL,USA,Cigar,1 minute,cigar shaped large craft with twinkling lights moving slowly and making no sound,12/22/22,
10/20/22 13:25,https://nuforc.org/webreports/reports/172/S172477.html,Booneville,MS,USA,Cigar,15 mins,"Brightest silver cigar shape, covered & moved slowly, no blinking lights.",12/22/22,Yes
10/18/22 18:00,https://nuforc.org/webreports/reports/172/S172482.html,Hampden,MA,USA,Cigar,2 minutes,"Clear day, no engine sounds, did not have characteristics of a plane in the sunlight.",12/22/22,
10/6/22 09:52,https://nuforc.org/webreports/reports/172/S172212.html,Palm City,FL,USA,Cigar,1 min in West Sky,White straight long object in sky not moving for about a minute and then disappeared fr,10/8/22,
10/4/22 18:45,https://nuforc.org/webreports/reports/172/S172490.html,Lake Charles,LA,USA,Cigar,About 3 minutes,"Brown, fast-moving object seen weaving through air.",12/22/22,Yes
10/1/22 15:34,https://nuforc.org/webreports/reports/172/S172157.html,Huntsville,AL,USA,Cigar,2 - 3 minutes,Cigar shaped with a bright circular light to the left of craft,10/8/22,Yes
9/29/22 20:29,https://nuforc.org/webreports/reports/172/S172506.html,Louisville,TN,USA,Cigar,105,Security camera footage of probe or craft looking in house all doors and drawers were also pulled open and a cat is missing from inside,12/22/22,
9/28/22 08:00,https://nuforc.org/webreports/reports/174/S174534.html,Toronto,ON,Canada,Cigar,2-3 seconds,Pill-capsule shaped metallic object seen from plane window,3/6/23,
9/24/22 21:45,https://nuforc.org/webreports/reports/174/S174639.html,Gettysburg,PA,USA,Cigar,3 minutes,It was at a diagonal with at least 20 or so orange lights that looked very close together almost square-like lights,3/6/23,Yes
9/24/22 19:30,https://nuforc.org/webreports/reports/172/S172080.html,Vick,null,,Cigar,5 minutes,Large translucent white cigar shape moving above tree line.,10/8/22,Yes
9/24/22 15:30,https://nuforc.org/webreports/reports/172/S172849.html,Houston,TX,USA,Cigar,1 minute,"Saw a very large white, cigar shaped UFO in NW Harris county in Texas. It was 3:30 pm, broad daylight.",12/22/22,
9/22/22 19:05,https://nuforc.org/webreports/reports/171/S171951.html,Green Cove Springs,FL,USA,Cigar,30 seconds,Looking forward out of our windshield we saw a bright reflection of the what we thought was a plane but apparently it was clearly not.,10/8/22,
9/19/22 21:00,https://nuforc.org/webreports/reports/171/S171894.html,Wilmington,NC,USA,Cigar,6 seconds,"it was a flying stick with large windows about 6 with white light coming out of the windows, it was flying fast and went quickly.",10/8/22,
9/19/22 19:45,https://nuforc.org/webreports/reports/171/S171910.html,Lackawanna,NY,USA,Cigar,10min,Flashing light standing pretty still in the sky seemed to fade in and out,10/8/22,
9/19/22 19:31,https://nuforc.org/webreports/reports/171/S171891.html,Dothan,AL,USA,Cigar,10 seconds,It's was cigar 5 bright lights. I walked outside after a misunderstanding with my girlfriend. As soon as I got outside I looked up and,10/8/22,
9/16/22 16:30,https://nuforc.org/webreports/reports/171/S171835.html,Silver Bay,NY,USA,Cigar,Clear view approx 7 minu,"I was out on the point for a wedding rehearsal, and I noticed something shimmering in sky.",10/8/22,
9/15/22 15:00,https://nuforc.org/webreports/reports/173/S173135.html,Loranger,LA,USA,Cigar,20 seconds,"Clear sunny day , Flying Southwest over Hammond Airport on Louisiana",12/22/22,
9/12/22 22:30,https://nuforc.org/webreports/reports/171/S171714.html,Windsor,,Canada,Cigar,5-10 seconds,A unknown object flying very low. Had no wings and was as loud and fast as a jet,10/8/22,
9/11/22 18:20,https://nuforc.org/webreports/reports/171/S171741.html,Molino,FL,USA,Cigar,Appx five minutes,Looking out to the West sky a large iridescent bright UFO moving slowly across the sky,10/8/22,
9/11/22 06:02,https://nuforc.org/webreports/reports/171/S171688.html,Riviera Beach,FL,USA,Cigar,45 seconds,Bright yellow orange cigar or cylindrical object appeared at the horizon.,10/8/22,Yes
9/11/22 05:30,https://nuforc.org/webreports/reports/171/S171690.html,palm bay,FL,USA,Cigar,8mins,very large craft cigar shape,10/8/22,Yes
9/7/22 08:10,https://nuforc.org/webreports/reports/171/S171634.html,Wappingers falls,NY,USA,Cigar,3 minutes while deiving,Large cigar shaped object made up of 5 or 6 spheres,9/9/22,Yes
9/5/22 12:51,https://nuforc.org/webreports/reports/173/S173267.html,??,NC,USA,Cigar,5 minutes,"Was on jetblue going to Florida. Was at 30,000 feet in the air.",12/22/22,Yes
9/5/22 06:12,https://nuforc.org/webreports/reports/171/S171591.html,Casper,WY,USA,Cigar,2min.,"White, glowing cigar shaped object",9/9/22,
9/5/22 04:41,https://nuforc.org/webreports/reports/171/S171674.html,Gardnerville,NV,USA,Cigar,45 seconds approx,"Cigar shaped, translucent, moving white lights. Moving west to east on a very northern horizon. Able to take 2 photos.",10/8/22,Yes
9/5/22 04:15,https://nuforc.org/webreports/reports/171/S171606.html,Dartmouth,MA,USA,Cigar,5-10 minutes,Long bright light Almost stationary then moving at a steady pace.,9/9/22,Yes
8/29/22 23:06,https://nuforc.org/webreports/reports/171/S171506.html,"Auburn, Enumclaw area",WA,USA,Cigar,8 minutes aprox.,"Outside we saw a black cigar shaped ufo with 2 white lights, one on each end.",9/9/22,Yes
