date,reportlink,city,state,country,shape,duration,description,post_date,images
9/29/17 12:00,https://nuforc.org/webreports/reports/136/S136451.html,La Vista,NE,USA,Cigar,2 seconds,off-white or light silver cigar shaped object drifting slowly across the sky.  ((anonymous report)),10/5/17,
9/27/17 18:00,https://nuforc.org/webreports/reports/136/S136504.html,Pottstown - Trenton,PA,USA,Cigar,00:04,Cigar shape on end shaped like a pill perfectly vertical did not change alt. whole obj. emitted bright red light.  ((anonymous report)),10/5/17,
9/27/17 07:28,https://nuforc.org/webreports/reports/136/S136400.html,Raleigh,NC,USA,Cigar,10 seconds,White cigar shaped UFO flew over small patch of sky I was watching at 7:28 AM.  ((anonymous report)),9/28/17,
9/26/17 10:07,https://nuforc.org/webreports/reports/136/S136659.html,Scarborough (Canada),ON,Canada,Cigar,5 minutes,A Very High Long Brilliant White Vertical Slow Moving Object,10/19/17,
9/25/17 00:00,https://nuforc.org/webreports/reports/136/S136354.html,Douglasville,GA,USA,Cigar,1-2 minutes,While driving from Birmingham Al. With a close friend I noticed A bright white light unlike anything I have seen before. With me workin,9/28/17,
9/23/17 07:05,https://nuforc.org/webreports/reports/136/S136308.html,Gaithersburg,MD,USA,Cigar,10 minutes,At 7:05am a passenger jet passed overhead.  The skies are clear.  Then following a ways behind the jet was either 2 egg white shaped cr,9/28/17,
9/9/17 13:00,https://nuforc.org/webreports/reports/136/S136103.html,Atlanta,GA,USA,Cigar,1 minute,"It looked like a plane at first, but I noticed it was simply white with no wings at all. It also had a slight metallic shine to it. As",9/12/17,
8/30/17 15:00,https://nuforc.org/webreports/reports/135/S135974.html,Vacaville or Fairfield (?) (near),CA,USA,Cigar,40 seconds,"Shiny with sun reflecting on what looked like cigar shaped object, hovering for 10-20 seconds, then line of extremely bright lights fla",9/5/17,
8/24/17 20:43,https://nuforc.org/webreports/reports/135/S135887.html,Tillamook,OR,USA,Cigar,3 minutes,"Three  cigar shaped lights, each at different distance, the third started my direction fast at first then slowed, then turned west a bi",9/5/17,
8/23/17,https://nuforc.org/webreports/reports/135/S135856.html,Spring Valley,OH,USA,Cigar,2 minutes,"Cigar-long as 3 City Buses, Hovering about 400 ft. above Ground Silver to Lt Blue. No Sound, Sped away to the W. ((anonymous report))",8/24/17,
8/1/17 21:45,https://nuforc.org/webreports/reports/135/S135484.html,Macomb,MI,USA,Cigar,5 minutes,"Cigar-shaped craft, all glowing orange.",8/4/17,
7/31/17 01:00,https://nuforc.org/webreports/reports/135/S135763.html,Fayetteville,NC,USA,Cigar,30 seconds,I saw a cigar-shaped aircraft with 3 bright lights that didn't blink.,8/24/17,
7/21/17 04:20,https://nuforc.org/webreports/reports/135/S135282.html,Chesterfield,MO,USA,Cigar,Continuous,2 white continuous lights 1 on top of other w/ green light in lower rt. corner in NE sky - enlarged pic shows cigar shape,7/23/17,
7/20/17 03:30,https://nuforc.org/webreports/reports/135/S135308.html,Boise,ID,USA,Cigar,1 minute,"Cigar-shaped ship, covered In glittery bright white lights.",7/23/17,
7/19/17 13:00,https://nuforc.org/webreports/reports/136/S136628.html,Auburn Hills,MI,USA,Cigar,2 minutes,"A white metallic cigar shaped aircraft with no windows (only a few black patches?),lights or wings on it. This craft was the size of 5",10/19/17,
7/18/17 16:00,https://nuforc.org/webreports/reports/135/S135336.html,Revere,MA,USA,Cigar,30 seconds,Strange cigar objects above Revere Beach,7/27/17,
7/16/17 20:07,https://nuforc.org/webreports/reports/135/S135192.html,Methuen,MA,USA,Cigar,10 minutes,Two white cigar shaped ufos cross over methuen,7/23/17,
7/16/17 10:20,https://nuforc.org/webreports/reports/135/S135207.html,New York City (Manhattan),NY,USA,Cigar,5,Cigar-shaped cylinder UFO and 4 smaller saucer spheres after it.,7/23/17,
7/14/17 22:30,https://nuforc.org/webreports/reports/135/S135161.html,Jacksonville,FL,USA,Cigar,Seconds,Flash of solid body with trail.  Anomalous movement.,7/23/17,
7/13/17 00:00,https://nuforc.org/webreports/reports/135/S135121.html,Marietta,SC,USA,Cigar,5 minutes,Craft with bright glowing lights fading from yellow to red in digital pattern.,7/14/17,
7/8/17 12:44,https://nuforc.org/webreports/reports/135/S135033.html,Telluride,CO,USA,Cigar,NA,unknown object in sky seen on photo taken during hike.,7/14/17,
7/5/17 08:14,https://nuforc.org/webreports/reports/135/S135004.html,New Kensington,PA,USA,Cigar,Uncertain,"My husband was taking pictures of an airplane refueling above our home.  After looking at the pictures, that were taken in rapid succes",7/14/17,
6/25/17 21:00,https://nuforc.org/webreports/reports/134/S134765.html,Maple Ridge (Canada),BC,Canada,Cigar,30 minutes,White cigar shaped slow moving and sometimes stationary object.,7/7/17,
6/24/17 12:00,https://nuforc.org/webreports/reports/134/S134852.html,Fairfield,WA,USA,Cigar,5 minutes,Sillver cigar shaped object witnessed by 2 people in eastern Washington.  Object hovered in western sky before vanishing,7/7/17,
6/23/17 09:23,https://nuforc.org/webreports/reports/135/S135437.html,Tampa,FL,USA,Cigar,~3 minutes,"We noticed a bright silver, cigar-shaped UFO flying along the edge of a nearby storm cloud.",8/4/17,
6/22/17 20:03,https://nuforc.org/webreports/reports/134/S134714.html,South Milwaukee,WI,USA,Cigar,2 minutes,Illuminated cigar shaped object flew in straight line overhead.,7/7/17,
6/21/17 04:05,https://nuforc.org/webreports/reports/134/S134689.html,San Dimas,CA,USA,Cigar,3 seconds,"Super-big object covered in bright white lights, and extremely slow moving",6/22/17,
6/20/17 11:00,https://nuforc.org/webreports/reports/146/S146563.html,Milford,UT,USA,Cigar,10 seconds,I was laying on the ground in my back yard with my sons dog. It was a clear day with a few high white cumulus clouds. I saw a cigar sha,6/7/19,
6/14/17 03:14,https://nuforc.org/webreports/reports/175/S175222.html,Outside Tulsa,OK,USA,Cigar,12 minutes,"Told my sister in Oregon who told me that over the Amazon site she worked at , there was a sighting of a craft that looked identical.",4/9/23,
6/4/17 18:30,https://nuforc.org/webreports/reports/134/S134450.html,Silver Spring,MD,USA,Cigar,10 minutes,"6/4/17 6.30 pm, Silver Spring, MD, the objects 10/11 were floating quietly very transparent like nothing inside.",6/9/17,
5/29/17 20:45,https://nuforc.org/webreports/reports/134/S134336.html,Colorado Springs,CO,USA,Cigar,4 minutes,2 UFO crafts circling above me then suddenly disappeared.  ((anonymous report)),6/2/17,
5/21/17 13:00,https://nuforc.org/webreports/reports/134/S134191.html,Jonesborough,TN,USA,Cigar,5-10 minutes,"Heard popping sound.. then looking up, saw glowing ball above cigar shaped object.",6/2/17,
5/17/17 23:45,https://nuforc.org/webreports/reports/136/S136897.html,Port St. Lucie,FL,USA,Cigar,15 seconds,Massive cigar-shaped craft 300 meters long.,11/3/17,
5/15/17 21:43,https://nuforc.org/webreports/reports/134/S134143.html,Ft. Collins,CO,USA,Cigar,22 minutes,Craft emerged from lightening storm,5/15/17,
5/15/17 03:00,https://nuforc.org/webreports/reports/149/S149994.html,Roxborough,PA,USA,Cigar,40 seconds,I was driving my car down Henry Avenue and I saw this object coming down a Crossing Street leverington Avenue I pulled up to a red ligh,12/1/19,
5/10/17 05:22,https://nuforc.org/webreports/reports/149/S149847.html,Alliston,ON,canada,Cigar,1hr or so,Cigar shaped objects in the air. multiple angles multiple time frames.,12/1/19,
5/9/17 17:45,https://nuforc.org/webreports/reports/134/S134046.html,Brooklyn Park,MN,USA,Cigar,17:45,"Cigar-shaped with dome, metallic headed West of Minneapolis at low level, was by 694W 17:45pm",5/11/17,
5/8/17 22:15,https://nuforc.org/webreports/reports/134/S134023.html,Northville,MI,USA,Cigar,2 minutes,"Ten twinkling lights moving across the sky, and then two cigar shaped lights moving after them.",5/11/17,
4/23/17 20:15,https://nuforc.org/webreports/reports/133/S133775.html,Marysville,OH,USA,Cigar,.20,"Cigar shaped UFO spotted on the horizon in Marysville, Ohio",4/28/17,
4/17/17 19:28,https://nuforc.org/webreports/reports/133/S133658.html,Gilbert,AZ,USA,Cigar,2 minutes,Red/orbs San Tan peak/jet engine facility.,4/20/17,
4/16/17 23:40,https://nuforc.org/webreports/reports/133/S133653.html,Ardsley,PA,USA,Cigar,2 minutes,Looked as if it were flying straight for my house. Both were an orangey color. One stayed still while the other flew around it. The one,4/20/17,
4/13/17 00:00,https://nuforc.org/webreports/reports/133/S133620.html,Phoenix,AZ,USA,Cigar,1 hour,"Red and yellow, stayed there for 1 whole hour.",4/20/17,
4/12/17 20:52,https://nuforc.org/webreports/reports/133/S133572.html,Surfside Beach,SC,USA,Cigar,3-4 seconds,"Single object with single bright light traveling at a high rate of speed, with no sound at a low altitude.",4/13/17,
4/7/17 09:25,https://nuforc.org/webreports/reports/133/S133451.html,Cooper City,FL,USA,Cigar,20 seconds,"White, cigar-shaped craft.  Daytime sighting over Cooper City - Broward County, FL.",4/7/17,
4/2/17 15:51,https://nuforc.org/webreports/reports/133/S133419.html,Pioneertown (near),CA,USA,Cigar,unknown,"Unseen, captured in photograph.",4/7/17,
3/23/17 07:50,https://nuforc.org/webreports/reports/133/S133273.html,Asheville,NC,USA,Cigar,2 minutes,Object gave off a bright flash of light and disapeared,3/23/17,
3/11/17 06:00,https://nuforc.org/webreports/reports/133/S133114.html,Mt. Airy,NC,USA,Cigar,1 second,I saw a missle like object with a green flame for the tail fly by. There was no sound and it was very fast.  ((anonymous report)),3/17/17,
3/11/17 05:00,https://nuforc.org/webreports/reports/133/S133070.html,Wausau,WI,USA,Cigar,15 minutes,"Silver colored, cigar-shaped craft, hovered for 15 min, no sound.  Two red lights on bottom; yellow light, too.  ((anonymous report))",3/17/17,
3/10/17 20:30,https://nuforc.org/webreports/reports/133/S133129.html,Clarksville,TN,USA,Cigar,15 minutes,Bright lights moving through the sky at alarming speeds.,3/17/17,
3/9/17 20:49,https://nuforc.org/webreports/reports/133/S133415.html,Jackson,MS,USA,Cigar,5 minutes,"I was on my way home from a class, and I noticed a large object just north of Countyline Road. Initially, I thought it was an airplane",4/7/17,
3/6/17 13:00,https://nuforc.org/webreports/reports/133/S133234.html,Tralee (Ireland),,Ireland,Cigar,7 minutes,a group of my friends and I were coming home from a house the last night when we noticed a bright object in the sky.,3/23/17,
2/25/17 21:00,https://nuforc.org/webreports/reports/132/S132888.html,Canton,GA,USA,Cigar,2+hrs,100+ Hovering silent aircrafts  flying over our house  within the past 2 hours.,3/10/17,
2/16/17 16:30,https://nuforc.org/webreports/reports/132/S132668.html,Paducah,KY,USA,Cigar,<1 minute,I noticed a chrome cigar shapes craft hovering about 3000' above the city.  ((anonymous report)),2/17/17,
2/15/17 19:30,https://nuforc.org/webreports/reports/173/S173413.html,Seattle,WA,USA,Cigar,60 seconds,"Mirror-like cigar shaped craft slowed to a stop above us, rotated and then climbed in altitude so fast it was gone in a moment.",12/22/22,
2/12/17 08:30,https://nuforc.org/webreports/reports/132/S132563.html,Winter Springs,FL,USA,Cigar,60 seconds,White lit cigar shaped object moving very quickly and effortlessly for a minute before disappearing to the East in the blink of an eye.,2/17/17,
2/7/17 13:00,https://nuforc.org/webreports/reports/132/S132500.html,Sao Paulo (Brasil),,Brazil,Cigar,10 seconds,Avistamento de um CHARUTO metalico de uns 50 metros de largura.,2/10/17,
2/6/17 18:09,https://nuforc.org/webreports/reports/132/S132490.html,"Panama City Beach,  gulf",FL,USA,Cigar,15 seconds,I saw suddenly 2 lights appear as I looked into saw in a distance 2 lights and then another 3 lights that then appeared to be 5 or so t,2/10/17,
1/26/17 18:54,https://nuforc.org/webreports/reports/132/S132314.html,Towson,MD,USA,Cigar,15 minutes,"2 cigar shaped ufos hovered for about 10-15 minutes above horizon near forest, then immediately jetted directly vertical, into the sky.",1/26/17,
1/22/17 19:25,https://nuforc.org/webreports/reports/132/S132275.html,San Antonio,FL,USA,Cigar,seconds,Strange object immerges from dark portal and streaks across sky ahead of oncoming storm and disappears into another dark portal.,1/26/17,
1/19/17 02:28,https://nuforc.org/webreports/reports/132/S132234.html,Minneapolis,MN,USA,Cigar,30 minutes,Interesting sighting over Uptown Minneapolis.,1/19/17,
1/12/17 18:45,https://nuforc.org/webreports/reports/132/S132156.html,New York City (Brooklyn),NY,USA,Cigar,8 minutes,UFO OVER BKLYN LAST NIGHT.,1/19/17,
1/1/17 14:02,https://nuforc.org/webreports/reports/132/S132189.html,Oshawa (Canada),ON,Canada,Cigar,6 minutes,Very High Slow Brilliant Shimmering White Oblong Object.  ((NUFORC Note:  One of many reports from same source.  PD)),1/19/17,
1/1/17 01:00,https://nuforc.org/webreports/reports/132/S132158.html,Placida,FL,USA,Cigar,1 minutes,"Cigar-shaped glowing orange object silently moving steadily from south to north 100 yds away, suddenly disappears seen by six adults.",1/19/17,
12/27/16 15:00,https://nuforc.org/webreports/reports/131/S131859.html,Jackson,TN,USA,Cigar,23-30 seconds,"Lights over Jackson, Tennessee.",12/30/16,
12/10/16 20:41,https://nuforc.org/webreports/reports/131/S131734.html,Virginia Beach (City of),VA,USA,Cigar,<1 minute,Virginia Beach UFO.,12/15/16,
12/9/16 07:15,https://nuforc.org/webreports/reports/131/S131680.html,Pune (India),,India,Cigar,15 seconds,I was waiting for the bus in the morning when I saw a white shining thing flying in the sky it was moving ahead I have captured a video,12/15/16,
11/28/16 06:51,https://nuforc.org/webreports/reports/131/S131514.html,Athens,GA,USA,Cigar,1 minute,White flying cigar.,12/5/16,
11/18/16 08:25,https://nuforc.org/webreports/reports/131/S131254.html,New York City (Bronx),NY,USA,Cigar,>1.3 minutes,Long shape with red & yellow going around with no en trail nor wings going around and around,12/5/16,
11/11/16 21:45,https://nuforc.org/webreports/reports/131/S131192.html,Anchorage,AK,USA,Cigar,5 seconds,Bright orange pointed cigar 50 degrees above dithers horizon going full east to west in 5 sec.  Appeared to be very low and faster than,12/5/16,
11/11/16 07:20,https://nuforc.org/webreports/reports/131/S131156.html,Leominster,MA,USA,Cigar,5 minutes,Very large metallic craft hovered then darted away at very high speed towards the sun.  ((anonymous report)),11/11/16,
11/10/16 16:28,https://nuforc.org/webreports/reports/131/S131307.html,Irma,WI,USA,Cigar,15 minutes,"300ft silver cigar shape, 900 ft up, no wings, windows, engines, sound, Lights, markings, fuselage, tail section, or exhaust!!!",12/5/16,
11/4/16 22:25,https://nuforc.org/webreports/reports/131/S131013.html,Santa Rosa,CA,USA,Cigar,2-3 seconds,My friends and I were running late at night about 10:25ish. They were on skateboards right in front of me.,11/11/16,
11/2/16 23:00,https://nuforc.org/webreports/reports/130/S130973.html,Huntsville,AL,USA,Cigar,1 hour,Me and my friend saw to very bright space crafts pass by my house while we watching the stars.,11/4/16,
10/28/16 21:37,https://nuforc.org/webreports/reports/131/S131675.html,Virginia Beach,VA,USA,Cigar,37 seconds,"Large, silent, stadium light high, floating completely still appearance of commercial aircraft; so CLOSE to me it can't be dismissed",12/15/16,
10/26/16 17:30,https://nuforc.org/webreports/reports/130/S130854.html,Fort Worth,TX,USA,Cigar,10 seconds,Noticed something very bright reflecting the sun.,10/27/16,
10/22/16 23:38,https://nuforc.org/webreports/reports/130/S130802.html,Philadelphia,PA,USA,Cigar,55 seconds,"Using my binoculars I witnessed a cigar shaped, rusty orange colored object fly from my south to east .",10/27/16,
10/18/16 19:00,https://nuforc.org/webreports/reports/130/S130700.html,Tornado,WV,USA,Cigar,10 minutes,Cigar shaped craft flew very slowly overhead.,10/21/16,
10/9/16 10:30,https://nuforc.org/webreports/reports/130/S130551.html,Marietta,GA,USA,Cigar,1 hour,Three silent white cigar shaped objects floated across the sky at 10:30 to 11:30 Sunday morning.,10/11/16,
10/5/16 22:30,https://nuforc.org/webreports/reports/130/S130456.html,Howell,NJ,USA,Cigar,10 seconds,Bar shaped ufo with three bright lights across.,10/11/16,
10/5/16 10:00,https://nuforc.org/webreports/reports/130/S130740.html,Greenfield,OH,USA,Cigar,20 seconds,"Clear day sky. Observe white/silver cigar object resembling (size) the KC-10 but no markings, no tail, no wings, no sound, no contrail,",10/21/16,
9/26/16 04:08,https://nuforc.org/webreports/reports/130/S130217.html,Aurora,CO,USA,Cigar,10 seconds,"Similar to shooting star, bright green and left trails like smoke clouds. No noise cloud level so kinda close.",9/30/16,
9/24/16 07:30,https://nuforc.org/webreports/reports/130/S130183.html,Silverlake,CA,USA,Cigar,5 minutes,"Hovering rod and 3 moving orbs over Silverlake, Los Angeles",9/30/16,
9/23/16 20:32,https://nuforc.org/webreports/reports/130/S130328.html,Virginia Beach,VA,USA,Cigar,Seconds,VA Beach shore drive.  Cigar-shape 8' off ground yellow lights.  ((anonymous report)),9/30/16,
9/21/16 21:00,https://nuforc.org/webreports/reports/137/S137936.html,Rico,CO,USA,Cigar,15 minutes,Ufo sighting backpacking in the San Juans of Colorado.  ((anonymous report)),1/12/18,
9/16/16 14:45,https://nuforc.org/webreports/reports/129/S129978.html,Redding,CA,USA,Cigar,15 minutes,Cigar-shaped craft hovers then vanishes near Redding Muni Airport,9/22/16,
9/11/16 19:30,https://nuforc.org/webreports/reports/134/S134769.html,Downtown Nashville,TN,USA,Cigar,5 minutes,"Few cigar shaped UFOs only captured in pictures, not seen with the naked eye.",7/7/17,
9/11/16 11:00,https://nuforc.org/webreports/reports/130/S130359.html,Thornton,CO,USA,Cigar,4 minutes,((HOAX??))  Cigar shape moving steady east to west.  ((anonymous report)),10/11/16,
9/9/16 20:20,https://nuforc.org/webreports/reports/129/S129827.html,Paragould,AR,USA,Cigar,5 minutes,Large cigar or triangle shaped fast moving object with 2 lights.,9/15/16,
9/9/16 19:30,https://nuforc.org/webreports/reports/129/S129830.html,Albuquerque,NM,USA,Cigar,about ten minutes,Bright pink vertical cigar-shaped object observed in evening sky of Albuquerque to the west,9/15/16,
9/6/16 06:15,https://nuforc.org/webreports/reports/129/S129854.html,Gary,IN,USA,Cigar,3-5 minutes,"At about 6:15 am 0n September 6 2016, i was out back my house facing east, It was very clear blue skies with only 1 cloud in the sky it",9/15/16,
8/30/16 11:00,https://nuforc.org/webreports/reports/129/S129617.html,West Chicago,IL,USA,Cigar,5 seconds,Craft just disappeared.,9/2/16,
8/28/16 22:00,https://nuforc.org/webreports/reports/129/S129593.html,Toronto (Canada),ON,Canada,Cigar,5 seconds,"Imagine for a moment, as if the pattern of a tigers stripes was energetically oscillating at an extremely fast rate.",9/2/16,
8/26/16 07:00,https://nuforc.org/webreports/reports/129/S129533.html,Wilson,NC,USA,Cigar,5 minutes,"White, pill shaped, silent, wingless aircraft  glided from north to south across the horizon in full daylight.",8/29/16,
8/24/16 03:45,https://nuforc.org/webreports/reports/129/S129506.html,Mobile,AL,USA,Cigar,Mobile,"I was leaving work on I-65 S, @ around government blv exit and saw this in the air for a few minutes.",8/29/16,
8/22/16 19:00,https://nuforc.org/webreports/reports/129/S129453.html,Swedesboro,NJ,USA,Cigar,2-3 minutes,"Driving on Kings Highway, my husband, daughter and I, saw something in the sky.   It wasn't a plane, and there were 3 of them.",8/25/16,
8/20/16 19:32,https://nuforc.org/webreports/reports/129/S129401.html,Oceanside,CA,USA,Cigar,1 minute,One silvery looking cigar with smoke out the back going toward the water and north.,8/25/16,
8/16/16 17:00,https://nuforc.org/webreports/reports/129/S129589.html,Snohomish,WA,USA,Cigar,2 minutes,Cigar and slowly spinning triangle in daylight.,9/2/16,
8/14/16 19:00,https://nuforc.org/webreports/reports/129/S129336.html,Sabattus,ME,USA,Cigar,,No sound cigar shaped Was in cloud.,8/19/16,
8/8/16 20:12,https://nuforc.org/webreports/reports/129/S129125.html,Sandy (suburb of SLC),UT,USA,Cigar,~5-6 minutes,"Cigar-shaped object hovering over mountains East of Sandy, UT",8/16/16,
8/7/16 00:30,https://nuforc.org/webreports/reports/129/S129089.html,Seattle,WA,USA,Cigar,30 seconds,Straight Line of White Circular Lights Traveling W to E,8/16/16,
8/4/16 19:53,https://nuforc.org/webreports/reports/131/S131030.html,Fairborn,OH,USA,Cigar,30 seconds,Metallic Pill Shaped UFO flys overhead at park near Wright Patterson Air Force Base.,11/11/16,
8/3/16 23:00,https://nuforc.org/webreports/reports/129/S129015.html,Cold Spring,NY,USA,Cigar,1-2 minutes,Low craft hovering slowly over Hudson River.,8/4/16,
7/27/16 22:45,https://nuforc.org/webreports/reports/128/S128843.html,St. George,UT,USA,Cigar,1 minute,A trail of burning light flew just above the southeastern horizon tonight.  ((NUFORC Note:  Chinese rocket re-entry.  PD)),8/2/16,
7/23/16 14:00,https://nuforc.org/webreports/reports/128/S128667.html,Eugene,OR,USA,Cigar,3-4 minutes,"Translucent object observed flying in the clear, blue afternoon sky.",8/2/16,
7/22/16 20:15,https://nuforc.org/webreports/reports/128/S128650.html,Walla Walla,WA,USA,Cigar,15-20 minutes,White and glowing about 50 ft from the skyline. After about 15 minutes it started descending rapidly towards the ground and disappeared,8/2/16,
7/18/16 19:00,https://nuforc.org/webreports/reports/128/S128596.html,Ash,NC,USA,Cigar,3 minutes,"Smaller aircraft which had no noise with rotating white lights, accompanied but super large area of twinkling smaller lights.",7/22/16,
7/17/16 18:30,https://nuforc.org/webreports/reports/128/S128559.html,Huntingdon,PA,USA,Cigar,15 seconds,Cigar shaped silver object in northeast moving quickly.,7/22/16,
7/15/16 13:25,https://nuforc.org/webreports/reports/128/S128526.html,Tulare,CA,USA,Cigar,1 minute,"Shiny, cigar-shaped, object hovering.",7/22/16,
7/14/16 18:00,https://nuforc.org/webreports/reports/128/S128500.html,Burlington,NJ,USA,Cigar,5 minutes,"Cigar shaped flying object in NE sky over Burlington Township, NJ.",7/15/16,
7/9/16 21:10,https://nuforc.org/webreports/reports/128/S128474.html,Oldsmar,FL,USA,Cigar,5 minutes,An object that appeared to be on fire passed laterally over open water then rose rapidly into the sky.,7/15/16,
7/9/16 18:45,https://nuforc.org/webreports/reports/129/S129818.html,Crawley (UK/England),,United Kingdom,Cigar,1 minute,Black cigar shaped object moving fast on slow mo,9/9/16,
7/9/16 07:30,https://nuforc.org/webreports/reports/128/S128409.html,Saint Augustine,FL,USA,Cigar,3-5 minutes,"3 silver cigars moving N/NE over St. Johns County, FL.",7/15/16,
7/4/16 22:19,https://nuforc.org/webreports/reports/128/S128354.html,Fort Wayne,IN,USA,Cigar,>1 hour (for all 5),Cigar-shaped objects with the orange flame in the front flying in a grid pattern.,7/8/16,
7/4/16 22:19,https://nuforc.org/webreports/reports/128/S128264.html,Fort Wayne,IN,USA,Cigar,60 seconds,Masala craft coming towards us in the sky just over the Treetops. It looked like a fireball but it did not move in a straight line. It,7/8/16,
7/4/16 21:37,https://nuforc.org/webreports/reports/128/S128261.html,Joliet,IL,USA,Cigar,~10 minutes,cigar shape light glowing blue with white lights on right side and left side white with lights,7/8/16,
7/3/16 11:04,https://nuforc.org/webreports/reports/132/S132252.html,Oshawa (Canada),ON,Canada,Cigar,4 minutes,High Slow Long Dark Object Flashing A Blue Bright Light,1/26/17,
7/1/16 22:15,https://nuforc.org/webreports/reports/128/S128929.html,Mount Laguna,CA,USA,Cigar,10-15 minutes,Pulsating cigar-shape object going across the sky.,8/2/16,
6/29/16 06:30,https://nuforc.org/webreports/reports/163/S163368.html,Perth (Australia),,Australia,Cigar,2 min,"I was on an airplane flight from USA to Melbourne, Australia. The sun was rising behind us, and it's the early morning hours. About an",7/31/21,
6/26/16 16:00,https://nuforc.org/webreports/reports/128/S128087.html,Aldie,VA,USA,Cigar,10 seconds,"Cigar shaped metal, silently hovering craft seen for 10 seconds in the sky northeast of Aldie Virginia which rotated then vanished.",7/8/16,
6/24/16 22:00,https://nuforc.org/webreports/reports/128/S128079.html,Novelty,OH,USA,Cigar,8 minutes,Saw large object after power went out in area.,7/8/16,
6/23/16 20:30,https://nuforc.org/webreports/reports/128/S128093.html,Minneapolis,MN,USA,Cigar,2 minutes,Red/Fiery object (or plane) in sky; Loud humming noise.,7/8/16,
6/21/16 19:30,https://nuforc.org/webreports/reports/128/S128026.html,Manheim,PA,USA,Cigar,3 minutes,Silver and possibly partially transparent craft approximately 1000 ft. in altitude; maybe 15 ft. in length; moving very fast in a perfe,6/24/16,
6/17/16 12:15,https://nuforc.org/webreports/reports/127/S127920.html,Bridgewater,NJ,USA,Cigar,3-5 minutes,Two tube-shaped bars or cylinders floating over Route 22.,6/24/16,
6/14/16 11:05,https://nuforc.org/webreports/reports/127/S127881.html,Richmond,KY,USA,Cigar,~2 minutes,"Clear, bright morning, 11:05 am, saw a pure white cylinder-shaped object in the sky above the tree lines, sailing fast.  No wings.",6/16/16,
6/11/16 19:08,https://nuforc.org/webreports/reports/127/S127827.html,Lafayette,LA,USA,Cigar,2 minutes,A cigar-shaped craft w/ a highly reflective surface heading south then southeast.,6/16/16,
6/9/16 13:00,https://nuforc.org/webreports/reports/127/S127788.html,Little River,SC,USA,Cigar,Ongoing,Silver-white cigar shaped object(s) floating above the Grand Strand.,6/10/16,
6/6/16 10:30,https://nuforc.org/webreports/reports/127/S127734.html,Cedarcreek,MO,USA,Cigar,~5 minutes,"Spindle-shaped object with no wings, no sound, no vapor trail seen in clear sky in daylight.",6/10/16,
